394,Decode String,Medium, https://leetcode.com/problems/decode-string,amazon; facebook; snapchat; oracle; facebook; oracle; salesforce; snapchat; salesforce; snapchat; cisco; facebook; oracle; cisco; cisco; amazon; cisco; vmware; amazon; vmware; amazon; oracle,
395,Longest Substring with At Least K Repeating Characters,Medium, https://leetcode.com/problems/longest-substring-with-at-least-k-repeating-characters,amazon; facebook; facebook; facebook; amazon; amazon; amazon,
396,Rotate Function,Medium, https://leetcode.com/problems/rotate-function,amazon,
397,Integer Replacement,Medium, https://leetcode.com/problems/integer-replacement,amazon; amazon; amazon,
398,Random Pick Index,Medium, https://leetcode.com/problems/random-pick-index,facebook; facebook; facebook; facebook,
399,Evaluate Division,Medium, https://leetcode.com/problems/evaluate-division,amazon; facebook; facebook; facebook; amazon; facebook; amazon; amazon,
400,Nth Digit,Medium, https://leetcode.com/problems/nth-digit,facebook; facebook; facebook; facebook,
402,Remove K Digits,Medium, https://leetcode.com/problems/remove-k-digits,amazon; facebook; oracle; oracle; nutanix; snapchat; facebook; oracle; amazon; nutanix; vmware; amazon; vmware; amazon; oracle,
403,Frog Jump,Hard, https://leetcode.com/problems/frog-jump,amazon; facebook; nutanix; oracle; facebook; nutanix; nutanix; snapchat; facebook; oracle; amazon; facebook; nutanix; amazon; amazon; oracle,
404,Sum of Left Leaves,Easy, https://leetcode.com/problems/sum-of-left-leaves,amazon; facebook; mathworks; amazon; mathworks; amazon; amazon,
405,Convert a Number to Hexadecimal,Easy, https://leetcode.com/problems/convert-a-number-to-hexadecimal,facebook; facebook; facebook; facebook,
406,Queue Reconstruction by Height,Medium, https://leetcode.com/problems/queue-reconstruction-by-height,amazon; facebook; facebook; facebook; amazon; facebook; amazon; amazon,
407,Trapping Rain Water II,Hard, https://leetcode.com/problems/trapping-rain-water-ii,amazon; facebook; facebook; amazon; amazon; amazon,
408,Valid Word Abbreviation,Easy, https://leetcode.com/problems/valid-word-abbreviation,facebook; facebook; facebook; facebook,
409,Longest Palindrome,Easy, https://leetcode.com/problems/longest-palindrome,amazon; amazon; amazon,
410,Split Array Largest Sum,Hard, https://leetcode.com/problems/split-array-largest-sum,amazon; facebook; facebook; facebook; amazon; amazon; amazon,
412,Fizz Buzz,Easy, https://leetcode.com/problems/fizz-buzz,amazon; linkedin; oracle; salesforce; salesforce; capital-one; salesforce; oracle; capital-one; cisco; amazon; cisco; capital-one; amazon; linkedin; amazon; oracle,
413,Arithmetic Slices,Medium, https://leetcode.com/problems/arithmetic-slices,amazon; facebook; facebook; amazon; amazon; amazon,
414,Third Maximum Number,Easy, https://leetcode.com/problems/third-maximum-number,amazon; facebook; facebook; facebook; amazon; facebook; amazon; amazon,
415,Add Strings,Easy, https://leetcode.com/problems/add-strings,amazon; facebook; snapchat; oracle; facebook; oracle; snapchat; snapchat; nvidia; facebook; oracle; amazon; nvidia; facebook; amazon; airbnb; amazon; oracle,
416,Partition Equal Subset Sum,Medium, https://leetcode.com/problems/partition-equal-subset-sum,amazon; facebook; facebook; facebook; paypal; amazon; vmware; paypal; facebook; vmware; amazon; vmware; amazon,
417,Pacific Atlantic Water Flow,Medium, https://leetcode.com/problems/pacific-atlantic-water-flow,amazon; facebook; facebook; facebook; oracle; amazon; amazon; amazon; oracle,
419,Battleships in a Board,Medium, https://leetcode.com/problems/battleships-in-a-board,amazon; facebook; facebook; facebook; amazon; facebook; amazon; amazon,
420,Strong Password Checker,Hard, https://leetcode.com/problems/strong-password-checker,amazon; amazon; amazon,
421,Maximum XOR of Two Numbers in an Array,Medium, https://leetcode.com/problems/maximum-xor-of-two-numbers-in-an-array,amazon; amazon; amazon,
425,Word Squares,Hard, https://leetcode.com/problems/word-squares,oracle; oracle; oracle,
426,Convert Binary Search Tree to Sorted Doubly Linked List,Medium, https://leetcode.com/problems/convert-binary-search-tree-to-sorted-doubly-linked-list,amazon; facebook; databricks; facebook; databricks; facebook; oracle; amazon; facebook; databricks; vmware; amazon; vmware; amazon; oracle,
427,Construct Quad Tree,Medium, https://leetcode.com/problems/construct-quad-tree,amazon; amazon; amazon,
428,Serialize and Deserialize N-ary Tree,Hard, https://leetcode.com/problems/serialize-and-deserialize-n-ary-tree,linkedin; facebook; facebook; facebook; amazon; facebook; amazon; linkedin,
429,N-ary Tree Level Order Traversal,Medium, https://leetcode.com/problems/n-ary-tree-level-order-traversal,amazon; amazon; amazon,
430,Flatten a Multilevel Doubly Linked List,Medium, https://leetcode.com/problems/flatten-a-multilevel-doubly-linked-list,amazon; facebook; facebook; facebook; amazon; facebook; amazon; amazon,
432,All O`one Data Structure,Hard, https://leetcode.com/problems/all-oone-data-structure,amazon; linkedin; facebook; facebook; facebook; linkedin; amazon; facebook; amazon; linkedin; linkedin; amazon,
433,Minimum Genetic Mutation,Medium, https://leetcode.com/problems/minimum-genetic-mutation,amazon; amazon,
435,Non-overlapping Intervals,Medium, https://leetcode.com/problems/non-overlapping-intervals,amazon; facebook; facebook; facebook; amazon; facebook; amazon; amazon,
437,Path Sum III,Medium, https://leetcode.com/problems/path-sum-iii,amazon; facebook; oracle; facebook; oracle; facebook; oracle; amazon; facebook; amazon; amazon; oracle,
438,Find All Anagrams in a String,Medium, https://leetcode.com/problems/find-all-anagrams-in-a-string,amazon; facebook; oracle; facebook; oracle; goldman-sachs; facebook; oracle; goldman-sachs; amazon; facebook; amazon; amazon; oracle,
439,Ternary Expression Parser,Medium, https://leetcode.com/problems/ternary-expression-parser,snapchat,
441,Arranging Coins,Easy, https://leetcode.com/problems/arranging-coins,godaddy; godaddy,
442,Find All Duplicates in an Array,Medium, https://leetcode.com/problems/find-all-duplicates-in-an-array,amazon; facebook; facebook; facebook; amazon; facebook; amazon; amazon,
443,String Compression,Easy, https://leetcode.com/problems/string-compression,amazon; facebook; godaddy; facebook; goldman-sachs; goldman-sachs; snapchat; goldman-sachs; facebook; goldman-sachs; amazon; facebook; amazon; amazon,
445,Add Two Numbers II,Medium, https://leetcode.com/problems/add-two-numbers-ii,amazon; facebook; oracle; facebook; goldman-sachs; facebook; oracle; cisco; goldman-sachs; amazon; cisco; amazon; amazon; oracle,
446,Arithmetic Slices II - Subsequence,Hard, https://leetcode.com/problems/arithmetic-slices-ii-subsequence,facebook; facebook,
447,Number of Boomerangs,Easy, https://leetcode.com/problems/number-of-boomerangs,amazon; amazon,
449,Serialize and Deserialize BST,Medium, https://leetcode.com/problems/serialize-and-deserialize-bst,amazon; linkedin; facebook; qualtrics; oracle; facebook; facebook; oracle; linkedin; amazon; qualtrics; facebook; amazon; linkedin; amazon; oracle,
450,Delete Node in a BST,Medium, https://leetcode.com/problems/delete-node-in-a-bst,amazon; linkedin; facebook; oracle; facebook; oracle; cisco; facebook; oracle; cisco; cisco; amazon; cisco; amazon; linkedin; amazon; oracle,
451,Sort Characters By Frequency,Medium, https://leetcode.com/problems/sort-characters-by-frequency,amazon; linkedin; facebook; facebook; amazon; amazon; linkedin; amazon,
452,Minimum Number of Arrows to Burst Balloons,Medium, https://leetcode.com/problems/minimum-number-of-arrows-to-burst-balloons,facebook; facebook; facebook; amazon; facebook; amazon; amazon,
453,Minimum Moves to Equal Array Elements,Easy, https://leetcode.com/problems/minimum-moves-to-equal-array-elements,amazon; amazon; amazon; amazon,
456,132 Pattern,Medium, https://leetcode.com/problems/132-pattern,oracle; oracle; oracle; amazon; amazon; amazon; oracle,
457,Circular Array Loop,Medium, https://leetcode.com/problems/circular-array-loop,nutanix; nutanix,
459,Repeated Substring Pattern,Easy, https://leetcode.com/problems/repeated-substring-pattern,amazon; amazon; amazon,
460,LFU Cache,Hard, https://leetcode.com/problems/lfu-cache,amazon; linkedin; snapchat; goldman-sachs; salesforce; salesforce; salesforce; goldman-sachs; snapchat; linkedin; goldman-sachs; amazon; vmware; vmware; amazon; vmware; linkedin; amazon,
461,Hamming Distance,Easy, https://leetcode.com/problems/hamming-distance,facebook; amazon; amazon; amazon,
463,Island Perimeter,Easy, https://leetcode.com/problems/island-perimeter,amazon; facebook; facebook; facebook; amazon; facebook; amazon; amazon,
464,Can I Win,Medium, https://leetcode.com/problems/can-i-win,linkedin; linkedin; linkedin,
465,Optimal Account Balancing,Hard, https://leetcode.com/problems/optimal-account-balancing,amazon; amazon; amazon; amazon,
466,Count The Repetitions,Hard, https://leetcode.com/problems/count-the-repetitions,amazon; amazon; amazon; amazon,
467,Unique Substrings in Wraparound String,Medium, https://leetcode.com/problems/unique-substrings-in-wraparound-string,maq-software,
468,Validate IP Address,Medium, https://leetcode.com/problems/validate-ip-address,facebook; facebook; facebook; cisco; amazon; cisco; amazon; amazon,
470,Implement Rand10() Using Rand7(),Medium, https://leetcode.com/problems/implement-rand10-using-rand7,linkedin; linkedin; linkedin; linkedin,
472,Concatenated Words,Hard, https://leetcode.com/problems/concatenated-words,amazon; facebook; facebook; facebook; amazon; facebook; amazon; amazon,
473,Matchsticks to Square,Medium, https://leetcode.com/problems/matchsticks-to-square,amazon; amazon; amazon; amazon,
475,Heaters,Easy, https://leetcode.com/problems/heaters,amazon; amazon,
477,Total Hamming Distance,Medium, https://leetcode.com/problems/total-hamming-distance,facebook; facebook,
478,Generate Random Point in a Circle,Medium, https://leetcode.com/problems/generate-random-point-in-a-circle,facebook; facebook,
480,Sliding Window Median,Hard, https://leetcode.com/problems/sliding-window-median,amazon; facebook; snapchat; facebook; snapchat; facebook; amazon; facebook; amazon; amazon,
485,Max Consecutive Ones,Easy, https://leetcode.com/problems/max-consecutive-ones,amazon; amazon; amazon,
486,Predict the Winner,Medium, https://leetcode.com/problems/predict-the-winner,amazon; amazon; amazon,
489,Robot Room Cleaner,Hard, https://leetcode.com/problems/robot-room-cleaner,amazon; facebook; facebook; facebook; amazon; amazon; amazon,
490,The Maze,Medium, https://leetcode.com/problems/the-maze,amazon; facebook; facebook; facebook; amazon; facebook; amazon; amazon,
491,Increasing Subsequences,Medium, https://leetcode.com/problems/increasing-subsequences,facebook; facebook; facebook; facebook,
493,Reverse Pairs,Hard, https://leetcode.com/problems/reverse-pairs,amazon; amazon,
494,Target Sum,Medium, https://leetcode.com/problems/target-sum,facebook; facebook; facebook; facebook,
496,Next Greater Element I,Easy, https://leetcode.com/problems/next-greater-element-i,amazon; facebook; oracle; facebook; facebook; oracle; amazon; facebook; amazon; amazon; oracle,
498,Diagonal Traverse,Medium, https://leetcode.com/problems/diagonal-traverse,facebook; facebook; facebook; amazon; facebook; amazon; amazon,
500,Keyboard Row,Easy, https://leetcode.com/problems/keyboard-row,mathworks; mathworks; mathworks,
501,Find Mode in Binary Search Tree,Easy, https://leetcode.com/problems/find-mode-in-binary-search-tree,amazon; amazon,
503,Next Greater Element II,Medium, https://leetcode.com/problems/next-greater-element-ii,amazon; facebook; oracle; facebook; facebook; oracle; amazon; facebook; amazon; amazon; oracle,
505,The Maze II,Medium, https://leetcode.com/problems/the-maze-ii,facebook; oracle; facebook; facebook; oracle; amazon; amazon; oracle,
507,Perfect Number,Easy, https://leetcode.com/problems/perfect-number,amazon; amazon; amazon,
508,Most Frequent Subtree Sum,Medium, https://leetcode.com/problems/most-frequent-subtree-sum,amazon; amazon,
509,Fibonacci Number,Easy, https://leetcode.com/problems/fibonacci-number,amazon; facebook; facebook; barclays; barclays; mathworks; facebook; barclays; amazon; facebook; mathworks; amazon; amazon,
515,Find Largest Value in Each Tree Row,Medium, https://leetcode.com/problems/find-largest-value-in-each-tree-row,amazon; linkedin; facebook; facebook; facebook; amazon; facebook; amazon; amazon,
516,Longest Palindromic Subsequence,Medium, https://leetcode.com/problems/longest-palindromic-subsequence,linkedin; facebook; facebook; facebook; amazon; amazon; linkedin; amazon,
517,Super Washing Machines,Hard, https://leetcode.com/problems/super-washing-machines,amazon,
518,Coin Change 2,Medium, https://leetcode.com/problems/coin-change-2,amazon; facebook; facebook; oracle; amazon; amazon; amazon; oracle,
523,Continuous Subarray Sum,Medium, https://leetcode.com/problems/continuous-subarray-sum,amazon; facebook; facebook; facebook; samsung; amazon; samsung; facebook; amazon; amazon,
524,Longest Word in Dictionary through Deleting,Medium, https://leetcode.com/problems/longest-word-in-dictionary-through-deleting,goldman-sachs; goldman-sachs; goldman-sachs; goldman-sachs,
525,Contiguous Array,Medium, https://leetcode.com/problems/contiguous-array,amazon; facebook; facebook; facebook; amazon; facebook; vmware; amazon; vmware; amazon,
526,Beautiful Arrangement,Medium, https://leetcode.com/problems/beautiful-arrangement,mathworks; mathworks; mathworks; mathworks,
527,Word Abbreviation,Hard, https://leetcode.com/problems/word-abbreviation,snapchat; snapchat,
528,Random Pick with Weight,Medium, https://leetcode.com/problems/random-pick-with-weight,amazon; linkedin; facebook; rubrik; facebook; tripadvisor; facebook; tripadvisor; amazon; facebook; amazon; linkedin; amazon,
529,Minesweeper,Medium, https://leetcode.com/problems/minesweeper,amazon; facebook; facebook; facebook; oracle; amazon; facebook; amazon; amazon; oracle,
532,K-diff Pairs in an Array,Easy, https://leetcode.com/problems/k-diff-pairs-in-an-array,goldman-sachs; twilio; salesforce; salesforce; goldman-sachs; goldman-sachs; oracle; paypal; goldman-sachs; amazon; paypal; amazon; twilio; oracle,
535,Encode and Decode TinyURL,Medium, https://leetcode.com/problems/encode-and-decode-tinyurl,amazon; facebook; oracle; oracle; amazon; amazon; amazon; oracle,
536,Construct Binary Tree from String,Medium, https://leetcode.com/problems/construct-binary-tree-from-string,facebook; facebook; facebook; facebook; amazon,
537,Complex Number Multiplication,Medium, https://leetcode.com/problems/complex-number-multiplication,amazon,
538,Convert BST to Greater Tree,Easy, https://leetcode.com/problems/convert-bst-to-greater-tree,amazon; amazon; amazon; amazon,
539,Minimum Time Difference,Medium, https://leetcode.com/problems/minimum-time-difference,palantir-technologies; palantir-technologies; palantir-technologies; amazon; amazon; palantir-technologies; amazon,
540,Single Element in a Sorted Array,Medium, https://leetcode.com/problems/single-element-in-a-sorted-array,amazon; facebook; facebook; facebook; amazon; facebook; amazon; amazon,
541,Reverse String II,Easy, https://leetcode.com/problems/reverse-string-ii,amazon; amazon; amazon,
542,01 Matrix,Medium, https://leetcode.com/problems/01-matrix,amazon; amazon; amazon; amazon,
543,Diameter of Binary Tree,Easy, https://leetcode.com/problems/diameter-of-binary-tree,amazon; facebook; qualtrics; oracle; facebook; oracle; intel; intel; facebook; oracle; amazon; qualtrics; facebook; amazon; amazon; oracle,
545,Boundary of Binary Tree,Medium, https://leetcode.com/problems/boundary-of-binary-tree,amazon; oracle; oracle; oracle; amazon; amazon; amazon; oracle,
547,Friend Circles,Medium, https://leetcode.com/problems/friend-circles,amazon; linkedin; facebook; facebook; goldman-sachs; salesforce; salesforce; salesforce; goldman-sachs; goldman-sachs; facebook; goldman-sachs; amazon; facebook; amazon; linkedin; amazon,
548,Split Array with Equal Sum,Medium, https://leetcode.com/problems/split-array-with-equal-sum,facebook; facebook; facebook; facebook,
549,Binary Tree Longest Consecutive Sequence II,Medium, https://leetcode.com/problems/binary-tree-longest-consecutive-sequence-ii,facebook; facebook; facebook; amazon; facebook; amazon,
550,Game Play Analysis IV,Medium, https://leetcode.com/problems/game-play-analysis-iv,facebook; facebook; facebook,
553,Optimal Division,Medium, https://leetcode.com/problems/optimal-division,amazon,
554,Brick Wall,Medium, https://leetcode.com/problems/brick-wall,facebook; oracle; facebook; oracle; oracle,
556,Next Greater Element III,Medium, https://leetcode.com/problems/next-greater-element-iii,amazon; facebook; facebook; facebook; amazon; vmware; amazon; vmware; amazon,
557,Reverse Words in a String III,Easy, https://leetcode.com/problems/reverse-words-in-a-string-iii,snapchat; salesforce; salesforce; salesforce; snapchat; salesforce; paypal; amazon; paypal; amazon; amazon,
558,Logical OR of Two Binary Grids Represented as Quad-Trees,Medium, https://leetcode.com/problems/logical-or-of-two-binary-grids-represented-as-quad-trees,amazon; amazon,
559,Maximum Depth of N-ary Tree,Easy, https://leetcode.com/problems/maximum-depth-of-n-ary-tree,amazon; amazon; amazon; amazon,
560,Subarray Sum Equals K,Medium, https://leetcode.com/problems/subarray-sum-equals-k,amazon; linkedin; facebook; snapchat; facebook; goldman-sachs; twilio; goldman-sachs; snapchat; goldman-sachs; facebook; oracle; goldman-sachs; amazon; twilio; facebook; amazon; linkedin; twilio; amazon; oracle,
561,Array Partition I,Easy, https://leetcode.com/problems/array-partition-i,amazon; amazon,
564,Find the Closest Palindrome,Hard, https://leetcode.com/problems/find-the-closest-palindrome,amazon; facebook; nutanix; facebook; amazon; nutanix; amazon; amazon,
566,Reshape the Matrix,Easy, https://leetcode.com/problems/reshape-the-matrix,mathworks,
567,Permutation in String,Medium, https://leetcode.com/problems/permutation-in-string,amazon; facebook; facebook; facebook; amazon; facebook; amazon; amazon,
568,Maximum Vacation Days,Hard, https://leetcode.com/problems/maximum-vacation-days,facebook; facebook; facebook,
570,Managers with at Least 5 Direct Reports,Medium, https://leetcode.com/problems/managers-with-at-least-5-direct-reports,amazon; amazon; amazon,
572,Subtree of Another Tree,Easy, https://leetcode.com/problems/subtree-of-another-tree,amazon; facebook; facebook; samsung; amazon; samsung; amazon; amazon,
577,Employee Bonus,Easy, https://leetcode.com/problems/employee-bonus,netsuite,
578,Get Highest Answer Rate Question,Medium, https://leetcode.com/problems/get-highest-answer-rate-question,facebook,
579,Find Cumulative Salary of an Employee,Hard, https://leetcode.com/problems/find-cumulative-salary-of-an-employee,amazon; amazon; amazon,
581,Shortest Unsorted Continuous Subarray,Easy, https://leetcode.com/problems/shortest-unsorted-continuous-subarray,amazon; amazon; amazon; amazon,
582,Kill Process,Medium, https://leetcode.com/problems/kill-process,amazon; amazon,
584,Find Customer Referee,Easy, https://leetcode.com/problems/find-customer-referee,amazon; amazon; amazon; amazon,
586,Customer Placing the Largest Number of Orders,Easy, https://leetcode.com/problems/customer-placing-the-largest-number-of-orders,amazon; amazon; amazon; amazon,
588,Design In-Memory File System,Hard, https://leetcode.com/problems/design-in-memory-file-system,amazon; goldman-sachs; goldman-sachs; goldman-sachs; amazon; amazon; airbnb; airbnb; amazon,
590,N-ary Tree Postorder Traversal,Easy, https://leetcode.com/problems/n-ary-tree-postorder-traversal,amazon; amazon; amazon; amazon,
592,Fraction Addition and Subtraction,Medium, https://leetcode.com/problems/fraction-addition-and-subtraction,goldman-sachs; goldman-sachs; goldman-sachs; goldman-sachs,
593,Valid Square,Medium, https://leetcode.com/problems/valid-square,facebook; facebook; facebook,
597,Friend Requests I: Overall Acceptance Rate,Easy, https://leetcode.com/problems/friend-requests-i-overall-acceptance-rate,facebook; facebook; facebook,
599,Minimum Index Sum of Two Lists,Easy, https://leetcode.com/problems/minimum-index-sum-of-two-lists,oracle; oracle; oracle,
601,Human Traffic of Stadium,Hard, https://leetcode.com/problems/human-traffic-of-stadium,amazon; amazon,
602,Friend Requests II: Who Has the Most Friends,Medium, https://leetcode.com/problems/friend-requests-ii-who-has-the-most-friends,facebook; facebook,
604,Design Compressed String Iterator,Easy, https://leetcode.com/problems/design-compressed-string-iterator,amazon; amazon,
605,Can Place Flowers,Easy, https://leetcode.com/problems/can-place-flowers,linkedin; facebook; facebook; cisco; linkedin; amazon; cisco; amazon; linkedin; linkedin,
606,Construct String from Binary Tree,Easy, https://leetcode.com/problems/construct-string-from-binary-tree,amazon,
609,Find Duplicate File in System,Medium, https://leetcode.com/problems/find-duplicate-file-in-system,facebook; oracle; facebook; facebook; oracle; amazon; vmware; facebook; vmware; amazon; vmware; amazon; oracle,
611,Valid Triangle Number,Medium, https://leetcode.com/problems/valid-triangle-number,amazon; linkedin; facebook; facebook; facebook; linkedin; amazon; amazon; linkedin; amazon,
614,Second Degree Follower,Medium, https://leetcode.com/problems/second-degree-follower,facebook; databricks; facebook; facebook; databricks,
616,Add Bold Tag in String,Medium, https://leetcode.com/problems/add-bold-tag-in-string,facebook; facebook; facebook; facebook,
617,Merge Two Binary Trees,Easy, https://leetcode.com/problems/merge-two-binary-trees,oracle; oracle; amazon; amazon; amazon; oracle,
618,Students Report By Geography,Hard, https://leetcode.com/problems/students-report-by-geography,amazon; amazon,
621,Task Scheduler,Medium, https://leetcode.com/problems/task-scheduler,amazon; facebook; oracle; facebook; nutanix; facebook; oracle; amazon; facebook; nutanix; vmware; amazon; vmware; amazon; oracle,
622,Design Circular Queue,Medium, https://leetcode.com/problems/design-circular-queue,amazon; facebook; oracle; facebook; citadel; facebook; oracle; citadel; amazon; facebook; amazon; airbnb; airbnb; amazon; oracle,
626,Exchange Seats,Medium, https://leetcode.com/problems/exchange-seats,amazon; amazon; amazon,
628,Maximum Product of Three Numbers,Easy, https://leetcode.com/problems/maximum-product-of-three-numbers,amazon; facebook; citadel; goldman-sachs; facebook; citadel; cisco; goldman-sachs; amazon; cisco; amazon; citadel; citadel; amazon,
631,Design Excel Sum Formula,Hard, https://leetcode.com/problems/design-excel-sum-formula,amazon; amazon,
632,Smallest Range Covering Elements from K Lists,Hard, https://leetcode.com/problems/smallest-range-covering-elements-from-k-lists,amazon; facebook; snapchat; snapchat; snapchat; facebook; amazon; amazon; amazon,
633,Sum of Square Numbers,Easy, https://leetcode.com/problems/sum-of-square-numbers,linkedin,
634,Find the Derangement of An Array,Medium, https://leetcode.com/problems/find-the-derangement-of-an-array,amazon; amazon; amazon,
635,Design Log Storage System,Medium, https://leetcode.com/problems/design-log-storage-system,snapchat; amazon; amazon,
636,Exclusive Time of Functions,Medium, https://leetcode.com/problems/exclusive-time-of-functions,amazon; linkedin; facebook; oracle; facebook; oracle; facebook; oracle; linkedin; amazon; facebook; amazon; linkedin; amazon; oracle,
637,Average of Levels in Binary Tree,Easy, https://leetcode.com/problems/average-of-levels-in-binary-tree,facebook; facebook; facebook; amazon; facebook; amazon; amazon,
639,Decode Ways II,Hard, https://leetcode.com/problems/decode-ways-ii,facebook; facebook,
640,Solve the Equation,Medium, https://leetcode.com/problems/solve-the-equation,amazon; amazon; amazon; amazon,
641,Design Circular Deque,Medium, https://leetcode.com/problems/design-circular-deque,facebook; facebook,
642,Design Search Autocomplete System,Hard, https://leetcode.com/problems/design-search-autocomplete-system,amazon; facebook; snapchat; facebook; salesforce; salesforce; snapchat; facebook; amazon; amazon; amazon,
645,Set Mismatch,Easy, https://leetcode.com/problems/set-mismatch,amazon,
646,Maximum Length of Pair Chain,Medium, https://leetcode.com/problems/maximum-length-of-pair-chain,amazon; facebook; facebook; amazon; amazon; amazon,
647,Palindromic Substrings,Medium, https://leetcode.com/problems/palindromic-substrings,amazon; linkedin; facebook; facebook; citadel; goldman-sachs; goldman-sachs; goldman-sachs; mathworks; facebook; roblox; roblox; citadel; mathworks; mathworks; goldman-sachs; amazon; facebook; mathworks; vmware; amazon; roblox; citadel; citadel; vmware; amazon,
652,Find Duplicate Subtrees,Medium, https://leetcode.com/problems/find-duplicate-subtrees,facebook; oracle; facebook; oracle; amazon; amazon; amazon; oracle,
653,Two Sum IV - Input is a BST,Easy, https://leetcode.com/problems/two-sum-iv-input-is-a-bst,amazon; facebook; snapchat; facebook; servicenow; snapchat; facebook; samsung; amazon; servicenow; servicenow; facebook; amazon; servicenow; amazon,
654,Maximum Binary Tree,Medium, https://leetcode.com/problems/maximum-binary-tree,facebook; facebook; amazon; amazon; amazon,
655,Print Binary Tree,Medium, https://leetcode.com/problems/print-binary-tree,linkedin; facebook; facebook; linkedin,
657,Robot Return to Origin,Easy, https://leetcode.com/problems/robot-return-to-origin,goldman-sachs; goldman-sachs; goldman-sachs; goldman-sachs; amazon; amazon; amazon,
658,Find K Closest Elements,Medium, https://leetcode.com/problems/find-k-closest-elements,facebook; snapchat; facebook; snapchat; facebook; amazon; facebook; amazon,
