661,Image Smoother,Easy, https://leetcode.com/problems/image-smoother,amazon,
662,Maximum Width of Binary Tree,Medium, https://leetcode.com/problems/maximum-width-of-binary-tree,amazon; facebook; facebook; facebook; amazon; facebook; amazon; amazon,
663,Equal Tree Partition,Medium, https://leetcode.com/problems/equal-tree-partition,facebook; facebook; amazon,
665,Non-decreasing Array,Easy, https://leetcode.com/problems/non-decreasing-array,amazon; amazon; amazon,
669,Trim a Binary Search Tree,Easy, https://leetcode.com/problems/trim-a-binary-search-tree,facebook; facebook; facebook; amazon; facebook; amazon,
670,Maximum Swap,Medium, https://leetcode.com/problems/maximum-swap,facebook; facebook; facebook; amazon; facebook; amazon,
671,Second Minimum Node In a Binary Tree,Easy, https://leetcode.com/problems/second-minimum-node-in-a-binary-tree,linkedin; linkedin; amazon; amazon; linkedin; linkedin; amazon,
673,Number of Longest Increasing Subsequence,Medium, https://leetcode.com/problems/number-of-longest-increasing-subsequence,facebook; facebook; amazon; amazon,
674,Longest Continuous Increasing Subsequence,Easy, https://leetcode.com/problems/longest-continuous-increasing-subsequence,facebook; facebook; facebook; amazon; facebook; amazon; amazon,
675,Cut Off Trees for Golf Event,Hard, https://leetcode.com/problems/cut-off-trees-for-golf-event,amazon; amazon; amazon,
676,Implement Magic Dictionary,Medium, https://leetcode.com/problems/implement-magic-dictionary,facebook; facebook; facebook; facebook,
678,Valid Parenthesis String,Medium, https://leetcode.com/problems/valid-parenthesis-string,amazon; facebook; facebook; facebook; amazon; facebook; amazon; amazon,
679,24 Game,Hard, https://leetcode.com/problems/24-game,facebook; facebook; facebook; amazon; amazon,
680,Valid Palindrome II,Easy, https://leetcode.com/problems/valid-palindrome-ii,facebook; facebook; facebook; facebook,
681,Next Closest Time,Medium, https://leetcode.com/problems/next-closest-time,amazon; facebook; facebook; facebook; amazon; amazon; amazon,
682,Baseball Game,Easy, https://leetcode.com/problems/baseball-game,amazon; amazon; amazon; amazon,
683,K Empty Slots,Hard, https://leetcode.com/problems/k-empty-slots,amazon; amazon,
684,Redundant Connection,Medium, https://leetcode.com/problems/redundant-connection,amazon; amazon; amazon,
686,Repeated String Match,Easy, https://leetcode.com/problems/repeated-string-match,amazon; facebook; facebook; facebook; amazon; facebook; amazon; amazon,
687,Longest Univalue Path,Easy, https://leetcode.com/problems/longest-univalue-path,amazon; amazon,
688,Knight Probability in Chessboard,Medium, https://leetcode.com/problems/knight-probability-in-chessboard,amazon; facebook; goldman-sachs; goldman-sachs; goldman-sachs; facebook; goldman-sachs; amazon; amazon; amazon,
689,Maximum Sum of 3 Non-Overlapping Subarrays,Hard, https://leetcode.com/problems/maximum-sum-of-3-non-overlapping-subarrays,facebook; facebook; facebook; facebook,
690,Employee Importance,Easy, https://leetcode.com/problems/employee-importance,amazon; amazon; amazon; amazon,
691,Stickers to Spell Word,Hard, https://leetcode.com/problems/stickers-to-spell-word,facebook; facebook,
692,Top K Frequent Words,Medium, https://leetcode.com/problems/top-k-frequent-words,amazon; linkedin; facebook; oracle; facebook; oracle; salesforce; salesforce; tripadvisor; facebook; oracle; tripadvisor; amazon; facebook; vmware; amazon; vmware; linkedin; amazon; oracle,
694,Number of Distinct Islands,Medium, https://leetcode.com/problems/number-of-distinct-islands,amazon; facebook; oracle; facebook; facebook; oracle; amazon; facebook; amazon; amazon; oracle,
695,Max Area of Island,Medium, https://leetcode.com/problems/max-area-of-island,amazon; twitch; facebook; palantir-technologies; qualtrics; oracle; facebook; twitch; palantir-technologies; palantir-technologies; twitch; mathworks; facebook; oracle; amazon; qualtrics; facebook; mathworks; amazon; qualtrics; twitch; amazon; oracle,
697,Degree of an Array,Easy, https://leetcode.com/problems/degree-of-an-array,citrix; vmware; visa; citrix; mathworks; visa; citrix; mathworks; vmware; mathworks; vmware; vmware,
698,Partition to K Equal Sum Subsets,Medium, https://leetcode.com/problems/partition-to-k-equal-sum-subsets,amazon; linkedin; facebook; facebook; facebook; linkedin; amazon; facebook; vmware; amazon; linkedin; vmware; linkedin; amazon,
699,Falling Squares,Hard, https://leetcode.com/problems/falling-squares,amazon; amazon,
701,Insert into a Binary Search Tree,Medium, https://leetcode.com/problems/insert-into-a-binary-search-tree,amazon; facebook; facebook; amazon; amazon; amazon,
702,Search in a Sorted Array of Unknown Size,Medium, https://leetcode.com/problems/search-in-a-sorted-array-of-unknown-size,amazon; amazon; amazon,
703,Kth Largest Element in a Stream,Easy, https://leetcode.com/problems/kth-largest-element-in-a-stream,amazon; facebook; facebook; nutanix; nutanix; facebook; amazon; nutanix; amazon; amazon,
704,Binary Search,Easy, https://leetcode.com/problems/binary-search,amazon; amazon; amazon; amazon,
705,Design HashSet,Easy, https://leetcode.com/problems/design-hashset,amazon; amazon,
706,Design HashMap,Easy, https://leetcode.com/problems/design-hashmap,amazon; linkedin; facebook; vmware; oracle; facebook; oracle; goldman-sachs; salesforce; salesforce; salesforce; servicenow; goldman-sachs; goldman-sachs; nvidia; facebook; oracle; salesforce; linkedin; goldman-sachs; amazon; nvidia; vmware; facebook; vmware; amazon; vmware; servicenow; linkedin; amazon; oracle,
707,Design Linked List,Medium, https://leetcode.com/problems/design-linked-list,oracle; amazon; amazon; oracle,
708,Insert into a Sorted Circular Linked List,Medium, https://leetcode.com/problems/insert-into-a-sorted-circular-linked-list,facebook; facebook; facebook; amazon; facebook; amazon; amazon,
710,Random Pick with Blacklist,Hard, https://leetcode.com/problems/random-pick-with-blacklist,amazon; amazon,
711,Number of Distinct Islands II,Hard, https://leetcode.com/problems/number-of-distinct-islands-ii,amazon; amazon,
714,Best Time to Buy and Sell Stock with Transaction Fee,Medium, https://leetcode.com/problems/best-time-to-buy-and-sell-stock-with-transaction-fee,amazon; facebook; facebook; amazon; amazon; amazon,
715,Range Module,Hard, https://leetcode.com/problems/range-module,amazon; linkedin; oracle; amazon; amazon; machine-zone; linkedin; amazon; oracle,
716,Max Stack,Easy, https://leetcode.com/problems/max-stack,amazon; linkedin; facebook; snapchat; facebook; snapchat; facebook; linkedin; amazon; facebook; amazon; linkedin; linkedin; amazon,
718,Maximum Length of Repeated Subarray,Medium, https://leetcode.com/problems/maximum-length-of-repeated-subarray,citadel,
719,Find K-th Smallest Pair Distance,Hard, https://leetcode.com/problems/find-k-th-smallest-pair-distance,amazon; amazon,
720,Longest Word in Dictionary,Easy, https://leetcode.com/problems/longest-word-in-dictionary,goldman-sachs; goldman-sachs; goldman-sachs; amazon; amazon,
721,Accounts Merge,Medium, https://leetcode.com/problems/accounts-merge,amazon; linkedin; facebook; oracle; facebook; facebook; oracle; linkedin; amazon; facebook; amazon; linkedin; linkedin; amazon; oracle,
722,Remove Comments,Medium, https://leetcode.com/problems/remove-comments,databricks; databricks; qualtrics; oracle; goldman-sachs; databricks; goldman-sachs; oracle; goldman-sachs; qualtrics; databricks; oracle,
723,Candy Crush,Medium, https://leetcode.com/problems/candy-crush,twitch; facebook; rubrik; facebook; twitch; facebook; facebook; twitch,
724,Find Pivot Index,Easy, https://leetcode.com/problems/find-pivot-index,amazon; facebook; godaddy; facebook; citadel; goldman-sachs; salesforce; salesforce; godaddy; salesforce; goldman-sachs; goldman-sachs; facebook; citadel; goldman-sachs; amazon; facebook; amazon; amazon,
725,Split Linked List in Parts,Medium, https://leetcode.com/problems/split-linked-list-in-parts,amazon; amazon,
726,Number of Atoms,Hard, https://leetcode.com/problems/number-of-atoms,amazon; facebook; facebook; amazon; amazon; amazon,
727,Minimum Window Subsequence,Hard, https://leetcode.com/problems/minimum-window-subsequence,amazon; amazon; amazon,
729,My Calendar I,Medium, https://leetcode.com/problems/my-calendar-i,amazon; qualtrics; amazon; qualtrics; amazon; qualtrics; qualtrics; amazon,
730,Count Different Palindromic Subsequences,Hard, https://leetcode.com/problems/count-different-palindromic-subsequences,linkedin; facebook; facebook; facebook; linkedin; linkedin,
731,My Calendar II,Medium, https://leetcode.com/problems/my-calendar-ii,amazon; amazon,
732,My Calendar III,Hard, https://leetcode.com/problems/my-calendar-iii,amazon; amazon; amazon,
733,Flood Fill,Easy, https://leetcode.com/problems/flood-fill,amazon; facebook; snapchat; vmware; palantir-technologies; qualtrics; facebook; palantir-technologies; snapchat; palantir-technologies; snapchat; facebook; amazon; qualtrics; vmware; vmware; amazon; qualtrics; vmware; amazon,
735,Asteroid Collision,Medium, https://leetcode.com/problems/asteroid-collision,amazon; visa; visa; paypal; amazon; paypal; amazon; amazon,
737,Sentence Similarity II,Medium, https://leetcode.com/problems/sentence-similarity-ii,amazon; amazon; amazon; amazon,
738,Monotone Increasing Digits,Medium, https://leetcode.com/problems/monotone-increasing-digits,amazon,
739,Daily Temperatures,Medium, https://leetcode.com/problems/daily-temperatures,amazon; linkedin; facebook; goldman-sachs; goldman-sachs; cisco; nvidia; facebook; cisco; cisco; linkedin; goldman-sachs; amazon; nvidia; cisco; amazon; linkedin; linkedin; amazon,
741,Cherry Pickup,Hard, https://leetcode.com/problems/cherry-pickup,citrix; oracle; citrix; mathworks; oracle; citrix; mathworks; amazon; mathworks; amazon; amazon; oracle,
742,Closest Leaf in a Binary Tree,Medium, https://leetcode.com/problems/closest-leaf-in-a-binary-tree,facebook; databricks; facebook; databricks; facebook; amazon; facebook; databricks; amazon,
743,Network Delay Time,Medium, https://leetcode.com/problems/network-delay-time,amazon; amazon; amazon; amazon,
744,Find Smallest Letter Greater Than Target,Easy, https://leetcode.com/problems/find-smallest-letter-greater-than-target,linkedin; linkedin,
745,Prefix and Suffix Search,Hard, https://leetcode.com/problems/prefix-and-suffix-search,facebook,
746,Min Cost Climbing Stairs,Easy, https://leetcode.com/problems/min-cost-climbing-stairs,amazon; amazon,
750,Number Of Corner Rectangles,Medium, https://leetcode.com/problems/number-of-corner-rectangles,facebook,
751,IP to CIDR,Medium, https://leetcode.com/problems/ip-to-cidr,airbnb; airbnb,
752,Open the Lock,Medium, https://leetcode.com/problems/open-the-lock,facebook; facebook; amazon; amazon,
755,Pour Water,Medium, https://leetcode.com/problems/pour-water,airbnb; airbnb; airbnb,
756,Pyramid Transition Matrix,Medium, https://leetcode.com/problems/pyramid-transition-matrix,amazon; amazon; amazon; airbnb; airbnb; amazon,
759,Employee Free Time,Hard, https://leetcode.com/problems/employee-free-time,amazon; facebook; facebook; facebook; amazon; airbnb; facebook; amazon; airbnb; airbnb; amazon,
761,Special Binary String,Hard, https://leetcode.com/problems/special-binary-string,citrix; visa; visa; citrix; visa; citrix,
762,Prime Number of Set Bits in Binary Representation,Easy, https://leetcode.com/problems/prime-number-of-set-bits-in-binary-representation,amazon,
763,Partition Labels,Medium, https://leetcode.com/problems/partition-labels,amazon; facebook; facebook; facebook; amazon; amazon; amazon,
764,Largest Plus Sign,Medium, https://leetcode.com/problems/largest-plus-sign,facebook,
765,Couples Holding Hands,Hard, https://leetcode.com/problems/couples-holding-hands,amazon; amazon,
766,Toeplitz Matrix,Easy, https://leetcode.com/problems/toeplitz-matrix,facebook; facebook; facebook; facebook,
767,Reorganize String,Medium, https://leetcode.com/problems/reorganize-string,amazon; twitch; facebook; qualtrics; oracle; facebook; oracle; facebook; oracle; amazon; qualtrics; facebook; amazon; qualtrics; twitch; amazon; oracle,
770,Basic Calculator IV,Hard, https://leetcode.com/problems/basic-calculator-iv,roblox; roblox; roblox; amazon; amazon; roblox; amazon,
771,Jewels and Stones,Easy, https://leetcode.com/problems/jewels-and-stones,amazon; facebook; facebook; amazon; amazon; amazon,
772,Basic Calculator III,Hard, https://leetcode.com/problems/basic-calculator-iii,amazon; facebook; snapchat; facebook; snapchat; snapchat; facebook; amazon; facebook; amazon; amazon,
773,Sliding Puzzle,Hard, https://leetcode.com/problems/sliding-puzzle,facebook; facebook; facebook; amazon; airbnb; facebook; amazon; airbnb; airbnb,
775,Global and Local Inversions,Medium, https://leetcode.com/problems/global-and-local-inversions,amazon; amazon; amazon; amazon,
776,Split BST,Medium, https://leetcode.com/problems/split-bst,facebook; facebook; facebook; amazon,
778,Swim in Rising Water,Hard, https://leetcode.com/problems/swim-in-rising-water,facebook; facebook; facebook,
779,K-th Symbol in Grammar,Medium, https://leetcode.com/problems/k-th-symbol-in-grammar,amazon; amazon,
780,Reaching Points,Hard, https://leetcode.com/problems/reaching-points,goldman-sachs; salesforce; salesforce; goldman-sachs; goldman-sachs; goldman-sachs,
783,Minimum Distance Between BST Nodes,Easy, https://leetcode.com/problems/minimum-distance-between-bst-nodes,amazon; amazon,
784,Letter Case Permutation,Medium, https://leetcode.com/problems/letter-case-permutation,amazon; facebook; amazon; amazon; amazon,
785,Is Graph Bipartite?,Medium, https://leetcode.com/problems/is-graph-bipartite,amazon; linkedin; facebook; facebook; facebook; linkedin; amazon; facebook; amazon; linkedin; amazon,
787,Cheapest Flights Within K Stops,Medium, https://leetcode.com/problems/cheapest-flights-within-k-stops,amazon; facebook; facebook; facebook; amazon; airbnb; facebook; amazon; airbnb; airbnb; amazon,
788,Rotated Digits,Easy, https://leetcode.com/problems/rotated-digits,facebook; facebook; facebook,
791,Custom Sort String,Medium, https://leetcode.com/problems/custom-sort-string,facebook; facebook; facebook; amazon; facebook; amazon,
792,Number of Matching Subsequences,Medium, https://leetcode.com/problems/number-of-matching-subsequences,facebook; facebook; amazon; amazon,
794,Valid Tic-Tac-Toe State,Medium, https://leetcode.com/problems/valid-tic-tac-toe-state,facebook; facebook; oracle; amazon; amazon; amazon; oracle,
796,Rotate String,Easy, https://leetcode.com/problems/rotate-string,linkedin; oracle; linkedin; amazon; amazon; linkedin; amazon; oracle,
797,All Paths From Source to Target,Medium, https://leetcode.com/problems/all-paths-from-source-to-target,amazon; amazon; amazon; amazon,
801,Minimum Swaps To Make Sequences Increasing,Medium, https://leetcode.com/problems/minimum-swaps-to-make-sequences-increasing,facebook; amazon; amazon; amazon,
805,Split Array With Same Average,Hard, https://leetcode.com/problems/split-array-with-same-average,amazon; amazon; amazon,
807,Max Increase to Keep City Skyline,Medium, https://leetcode.com/problems/max-increase-to-keep-city-skyline,amazon; amazon,
811,Subdomain Visit Count,Easy, https://leetcode.com/problems/subdomain-visit-count,citrix; roblox; roblox; citrix; roblox; amazon; amazon; roblox,
814,Binary Tree Pruning,Medium, https://leetcode.com/problems/binary-tree-pruning,capital-one; capital-one; capital-one; amazon; capital-one; amazon,
815,Bus Routes,Hard, https://leetcode.com/problems/bus-routes,amazon; amazon; amazon; amazon,
819,Most Common Word,Easy, https://leetcode.com/problems/most-common-word,amazon; oracle; oracle; amazon; amazon; amazon; oracle,
821,Shortest Distance to a Character,Easy, https://leetcode.com/problems/shortest-distance-to-a-character,facebook; facebook,
824,Goat Latin,Easy, https://leetcode.com/problems/goat-latin,facebook; facebook; facebook; facebook,
825,Friends Of Appropriate Ages,Medium, https://leetcode.com/problems/friends-of-appropriate-ages,facebook; facebook; facebook; facebook,
826,Most Profit Assigning Work,Medium, https://leetcode.com/problems/most-profit-assigning-work,nutanix; amazon; nutanix; amazon,
827,Making A Large Island,Hard, https://leetcode.com/problems/making-a-large-island,amazon; facebook; facebook; facebook; amazon; facebook; amazon; amazon,
828,Count Unique Characters of All Substrings of a Given String,Hard, https://leetcode.com/problems/count-unique-characters-of-all-substrings-of-a-given-string,twitch; twitch,
829,Consecutive Numbers Sum,Hard, https://leetcode.com/problems/consecutive-numbers-sum,citrix; visa; citadel; roblox; citrix; visa; roblox; citrix; roblox; citadel; vmware; roblox; citadel; citadel; vmware,
832,Flipping an Image,Easy, https://leetcode.com/problems/flipping-an-image,facebook; facebook,
833,Find And Replace in String,Medium, https://leetcode.com/problems/find-and-replace-in-string,linkedin; linkedin,
836,Rectangle Overlap,Easy, https://leetcode.com/problems/rectangle-overlap,amazon; oracle; goldman-sachs; goldman-sachs; mathworks; oracle; goldman-sachs; amazon; mathworks; amazon; amazon; oracle,
839,Similar String Groups,Hard, https://leetcode.com/problems/similar-string-groups,amazon; facebook; snapchat; facebook; snapchat; facebook; amazon; facebook; amazon; amazon,
841,Keys and Rooms,Medium, https://leetcode.com/problems/keys-and-rooms,amazon; amazon; amazon; amazon,
842,Split Array into Fibonacci Sequence,Medium, https://leetcode.com/problems/split-array-into-fibonacci-sequence,amazon,
843,Guess the Word,Hard, https://leetcode.com/problems/guess-the-word,amazon; facebook; facebook; amazon; amazon; airbnb; airbnb; amazon,
844,Backspace String Compare,Easy, https://leetcode.com/problems/backspace-string-compare,amazon; facebook; oracle; facebook; facebook; oracle; amazon; facebook; amazon; amazon; oracle,
847,Shortest Path Visiting All Nodes,Hard, https://leetcode.com/problems/shortest-path-visiting-all-nodes,amazon; amazon,
848,Shifting Letters,Medium, https://leetcode.com/problems/shifting-letters,facebook; facebook,
849,Maximize Distance to Closest Person,Easy, https://leetcode.com/problems/maximize-distance-to-closest-person,amazon; amazon; amazon; amazon,
851,Loud and Rich,Medium, https://leetcode.com/problems/loud-and-rich,amazon,
852,Peak Index in a Mountain Array,Easy, https://leetcode.com/problems/peak-index-in-a-mountain-array,amazon; facebook; facebook; facebook; amazon; facebook; amazon; amazon,
854,K-Similar Strings,Hard, https://leetcode.com/problems/k-similar-strings,amazon; amazon; amazon,
855,Exam Room,Medium, https://leetcode.com/problems/exam-room,facebook; facebook; facebook; amazon; facebook; amazon,
856,Score of Parentheses,Medium, https://leetcode.com/problems/score-of-parentheses,amazon; amazon,
860,Lemonade Change,Easy, https://leetcode.com/problems/lemonade-change,amazon; amazon; amazon; amazon,
862,Shortest Subarray with Sum at Least K,Hard, https://leetcode.com/problems/shortest-subarray-with-sum-at-least-k,amazon; facebook; goldman-sachs; goldman-sachs; goldman-sachs; facebook; goldman-sachs; amazon; amazon; amazon,
863,All Nodes Distance K in Binary Tree,Medium, https://leetcode.com/problems/all-nodes-distance-k-in-binary-tree,amazon; facebook; oracle; facebook; facebook; oracle; amazon; facebook; amazon; amazon; oracle,
864,Shortest Path to Get All Keys,Hard, https://leetcode.com/problems/shortest-path-to-get-all-keys,airbnb; amazon; airbnb; amazon; airbnb; airbnb,
865,Smallest Subtree with all the Deepest Nodes,Medium, https://leetcode.com/problems/smallest-subtree-with-all-the-deepest-nodes,facebook; facebook; facebook; facebook,
866,Prime Palindrome,Medium, https://leetcode.com/problems/prime-palindrome,amazon; amazon; amazon,
867,Transpose Matrix,Easy, https://leetcode.com/problems/transpose-matrix,servicenow; servicenow,
871,Minimum Number of Refueling Stops,Hard, https://leetcode.com/problems/minimum-number-of-refueling-stops,amazon; amazon,
872,Leaf-Similar Trees,Easy, https://leetcode.com/problems/leaf-similar-trees,facebook; facebook; amazon; amazon,
873,Length of Longest Fibonacci Subsequence,Medium, https://leetcode.com/problems/length-of-longest-fibonacci-subsequence,amazon; amazon; amazon; amazon,
875,Koko Eating Bananas,Medium, https://leetcode.com/problems/koko-eating-bananas,amazon; facebook; facebook; facebook; amazon; airbnb; facebook; amazon; airbnb; airbnb; amazon,
876,Middle of the Linked List,Easy, https://leetcode.com/problems/middle-of-the-linked-list,oracle; oracle; goldman-sachs; paypal; goldman-sachs; goldman-sachs; oracle; paypal; cisco; goldman-sachs; samsung; amazon; samsung; paypal; cisco; paypal; amazon; amazon; oracle,
879,Profitable Schemes,Hard, https://leetcode.com/problems/profitable-schemes,linkedin; linkedin,
881,Boats to Save People,Medium, https://leetcode.com/problems/boats-to-save-people,amazon; amazon; amazon,
884,Uncommon Words from Two Sentences,Easy, https://leetcode.com/problems/uncommon-words-from-two-sentences,amazon; facebook; facebook; facebook; amazon; facebook; amazon; amazon,
885,Spiral Matrix III,Medium, https://leetcode.com/problems/spiral-matrix-iii,facebook; dataminr; facebook; facebook,
886,Possible Bipartition,Medium, https://leetcode.com/problems/possible-bipartition,facebook; facebook; facebook; facebook,
887,Super Egg Drop,Hard, https://leetcode.com/problems/super-egg-drop,facebook; facebook; goldman-sachs; goldman-sachs; facebook; goldman-sachs; facebook,
889,Construct Binary Tree from Preorder and Postorder Traversal,Medium, https://leetcode.com/problems/construct-binary-tree-from-preorder-and-postorder-traversal,facebook; facebook; amazon; amazon; amazon,
890,Find and Replace Pattern,Medium, https://leetcode.com/problems/find-and-replace-pattern,amazon,
893,Groups of Special-Equivalent Strings,Easy, https://leetcode.com/problems/groups-of-special-equivalent-strings,facebook,
894,All Possible Full Binary Trees,Medium, https://leetcode.com/problems/all-possible-full-binary-trees,oracle; oracle; oracle,
895,Maximum Frequency Stack,Hard, https://leetcode.com/problems/maximum-frequency-stack,amazon; salesforce; salesforce; salesforce; amazon; amazon; amazon,
896,Monotonic Array,Easy, https://leetcode.com/problems/monotonic-array,facebook; facebook; facebook; facebook,
899,Orderly Queue,Hard, https://leetcode.com/problems/orderly-queue,amazon,
900,RLE Iterator,Medium, https://leetcode.com/problems/rle-iterator,amazon; amazon,
901,Online Stock Span,Medium, https://leetcode.com/problems/online-stock-span,amazon; amazon; amazon; amazon,
902,Numbers At Most N Given Digit Set,Hard, https://leetcode.com/problems/numbers-at-most-n-given-digit-set,amazon,
904,Fruit Into Baskets,Medium, https://leetcode.com/problems/fruit-into-baskets,amazon; amazon,
905,Sort Array By Parity,Easy, https://leetcode.com/problems/sort-array-by-parity,facebook; vmware; facebook; cisco; facebook; oracle; cisco; cisco; amazon; vmware; cisco; vmware; amazon; vmware; amazon; oracle,
909,Snakes and Ladders,Medium, https://leetcode.com/problems/snakes-and-ladders,amazon; cisco; cisco; cisco; amazon; cisco; amazon; amazon,
912,Sort an Array,Medium, https://leetcode.com/problems/sort-an-array,amazon; amazon; amazon; amazon,
916,Word Subsets,Medium, https://leetcode.com/problems/word-subsets,amazon; facebook; facebook; amazon; amazon; amazon,
918,Maximum Sum Circular Subarray,Medium, https://leetcode.com/problems/maximum-sum-circular-subarray,facebook; facebook; facebook; amazon; facebook; amazon; amazon,
919,Complete Binary Tree Inserter,Medium, https://leetcode.com/problems/complete-binary-tree-inserter,amazon; amazon,
921,Minimum Add to Make Parentheses Valid,Medium, https://leetcode.com/problems/minimum-add-to-make-parentheses-valid,amazon; facebook; facebook; servicenow; facebook; amazon; facebook; amazon; servicenow; amazon,
922,Sort Array By Parity II,Easy, https://leetcode.com/problems/sort-array-by-parity-ii,amazon,
924,Minimize Malware Spread,Hard, https://leetcode.com/problems/minimize-malware-spread,amazon; amazon,
929,Unique Email Addresses,Easy, https://leetcode.com/problems/unique-email-addresses,amazon; amazon,
931,Minimum Falling Path Sum,Medium, https://leetcode.com/problems/minimum-falling-path-sum,amazon; goldman-sachs; goldman-sachs; amazon; amazon; amazon,
934,Shortest Bridge,Medium, https://leetcode.com/problems/shortest-bridge,facebook; facebook; facebook; mckinsey; facebook,
935,Knight Dialer,Medium, https://leetcode.com/problems/knight-dialer,facebook; facebook; citadel; twilio; facebook; citadel; twilio; facebook; citadel; citadel; twilio; twilio,
936,Stamping The Sequence,Hard, https://leetcode.com/problems/stamping-the-sequence,facebook; facebook; facebook; facebook,
937,Reorder Data in Log Files,Easy, https://leetcode.com/problems/reorder-data-in-log-files,amazon; amazon; amazon; amazon,
938,Range Sum of BST,Easy, https://leetcode.com/problems/range-sum-of-bst,amazon; facebook; oracle; facebook; oracle; facebook; oracle; amazon; facebook; amazon; amazon; oracle,
939,Minimum Area Rectangle,Medium, https://leetcode.com/problems/minimum-area-rectangle,facebook; facebook; goldman-sachs; goldman-sachs; goldman-sachs; nvidia; facebook; goldman-sachs; amazon; nvidia; facebook; amazon; nvidia; amazon,
942,DI String Match,Easy, https://leetcode.com/problems/di-string-match,goldman-sachs; goldman-sachs; goldman-sachs; goldman-sachs; amazon; amazon,
943,Find the Shortest Superstring,Hard, https://leetcode.com/problems/find-the-shortest-superstring,amazon; amazon,
946,Validate Stack Sequences,Medium, https://leetcode.com/problems/validate-stack-sequences,linkedin,
951,Flip Equivalent Binary Trees,Medium, https://leetcode.com/problems/flip-equivalent-binary-trees,amazon; amazon; amazon; amazon,
