1,Two Sum,Easy, https://leetcode.com/problems/two-sum,amazon; linkedin; intel; facebook; snapchat; godaddy; vmware; visa; oracle; facebook; oracle; godaddy; visa; intel; citadel; goldman-sachs; twilio; salesforce; salesforce; intel; godaddy; salesforce; servicenow; paypal; goldman-sachs; snapchat; goldman-sachs; mathworks; jpmorgan; cisco; nvidia; facebook; jpmorgan; samsung; visa; oracle; roblox; zoho; salesforce; roblox; zoho; citadel; cisco; mathworks; paypal; cisco; linkedin; goldman-sachs; samsung; amazon; nvidia; qualcomm; servicenow; servicenow; vmware; samsung; paypal; facebook; cisco; qualcomm; paypal; mathworks; vmware; amazon; roblox; qualcomm; nvidia; visa; airbnb; samsung; vmware; servicenow; linkedin; airbnb; twilio; amazon; oracle,
2,Add Two Numbers,Medium, https://leetcode.com/problems/add-two-numbers,amazon; facebook; vmware; oracle; facebook; intel; salesforce; salesforce; capital-one; intel; salesforce; servicenow; paypal; mathworks; nvidia; facebook; oracle; zoho; zoho; cisco; capital-one; paypal; cisco; amazon; nvidia; qualcomm; servicenow; vmware; paypal; facebook; cisco; qualcomm; paypal; capital-one; mathworks; vmware; amazon; zoho; qualcomm; airbnb; vmware; servicenow; airbnb; amazon; oracle,
3,Longest Substring Without Repeating Characters,Medium, https://leetcode.com/problems/longest-substring-without-repeating-characters,amazon; twitch; facebook; snapchat; vmware; oracle; facebook; oracle; goldman-sachs; salesforce; salesforce; salesforce; goldman-sachs; snapchat; goldman-sachs; cisco; facebook; oracle; zoho; zoho; cisco; paypal; cisco; goldman-sachs; samsung; amazon; vmware; samsung; paypal; facebook; cisco; vmware; amazon; zoho; twitch; vmware; amazon; oracle,
4,Median of Two Sorted Arrays,Hard, https://leetcode.com/problems/median-of-two-sorted-arrays,amazon; facebook; rubrik; godaddy; oracle; facebook; oracle; visa; goldman-sachs; rubrik; godaddy; goldman-sachs; goldman-sachs; jpmorgan; facebook; jpmorgan; visa; oracle; goldman-sachs; amazon; facebook; vmware; amazon; airbnb; vmware; airbnb; amazon; oracle,
5,Longest Palindromic Substring,Medium, https://leetcode.com/problems/longest-palindromic-substring,amazon; facebook; nutanix; godaddy; oracle; facebook; oracle; nutanix; nutanix; godaddy; servicenow; mathworks; jpmorgan; cisco; facebook; jpmorgan; oracle; roblox; roblox; cisco; paypal; cisco; samsung; amazon; servicenow; servicenow; samsung; paypal; facebook; cisco; nutanix; paypal; mathworks; vmware; amazon; airbnb; samsung; vmware; servicenow; airbnb; amazon; oracle,
6,ZigZag Conversion,Medium, https://leetcode.com/problems/zigzag-conversion,amazon; facebook; facebook; facebook; paypal; amazon; paypal; facebook; amazon; amazon,
7,Reverse Integer,Easy, https://leetcode.com/problems/reverse-integer,amazon; facebook; oracle; facebook; barclays; jpmorgan; facebook; jpmorgan; oracle; barclays; cisco; amazon; facebook; cisco; amazon; amazon; oracle,
8,String to Integer (atoi),Medium, https://leetcode.com/problems/string-to-integer-atoi,amazon; linkedin; facebook; vmware; oracle; facebook; oracle; citadel; goldman-sachs; goldman-sachs; goldman-sachs; cisco; nvidia; facebook; oracle; citadel; cisco; cisco; linkedin; goldman-sachs; amazon; nvidia; vmware; facebook; cisco; vmware; amazon; vmware; linkedin; amazon; oracle,
9,Palindrome Number,Easy, https://leetcode.com/problems/palindrome-number,amazon; facebook; oracle; jpmorgan; facebook; jpmorgan; oracle; amazon; amazon; amazon; oracle,
10,Regular Expression Matching,Hard, https://leetcode.com/problems/regular-expression-matching,amazon; facebook; databricks; databricks; oracle; facebook; oracle; palantir-technologies; databricks; palantir-technologies; facebook; oracle; amazon; facebook; databricks; amazon; airbnb; amazon; oracle,
11,Container With Most Water,Medium, https://leetcode.com/problems/container-with-most-water,amazon; facebook; facebook; goldman-sachs; goldman-sachs; goldman-sachs; facebook; oracle; goldman-sachs; amazon; facebook; vmware; amazon; vmware; amazon; oracle,
12,Integer to Roman,Medium, https://leetcode.com/problems/integer-to-roman,amazon; linkedin; facebook; oracle; salesforce; salesforce; paypal; opendoor; facebook; oracle; paypal; opendoor; linkedin; amazon; paypal; paypal; amazon; linkedin; amazon; oracle,
13,Roman to Integer,Easy, https://leetcode.com/problems/roman-to-integer,amazon; linkedin; facebook; qualtrics; oracle; facebook; goldman-sachs; facebook; oracle; linkedin; goldman-sachs; amazon; qualtrics; facebook; amazon; qualtrics; linkedin; amazon; oracle,
14,Longest Common Prefix,Easy, https://leetcode.com/problems/longest-common-prefix,amazon; facebook; snapchat; oracle; facebook; oracle; visa; twilio; snapchat; snapchat; facebook; visa; oracle; cisco; cisco; amazon; twilio; facebook; cisco; amazon; twilio; amazon; oracle,
15,3Sum,Medium, https://leetcode.com/problems/3sum,amazon; citrix; facebook; snapchat; vmware; qualtrics; visa; oracle; facebook; oracle; visa; citadel; salesforce; salesforce; citrix; citrix; servicenow; goldman-sachs; snapchat; mathworks; facebook; visa; oracle; zoho; citrix; zoho; citadel; mathworks; paypal; cisco; goldman-sachs; samsung; amazon; qualtrics; servicenow; vmware; samsung; paypal; facebook; cisco; paypal; mathworks; vmware; amazon; zoho; citadel; qualtrics; samsung; vmware; servicenow; amazon; oracle,
16,3Sum Closest,Medium, https://leetcode.com/problems/3sum-closest,amazon; facebook; facebook; goldman-sachs; goldman-sachs; facebook; goldman-sachs; amazon; facebook; vmware; amazon; vmware; amazon,
17,Letter Combinations of a Phone Number,Medium, https://leetcode.com/problems/letter-combinations-of-a-phone-number,amazon; facebook; oracle; facebook; oracle; nutanix; goldman-sachs; twilio; salesforce; salesforce; roblox; nutanix; salesforce; servicenow; goldman-sachs; goldman-sachs; jpmorgan; facebook; jpmorgan; oracle; roblox; roblox; cisco; goldman-sachs; amazon; servicenow; servicenow; facebook; cisco; nutanix; vmware; amazon; roblox; vmware; servicenow; twilio; amazon; oracle,
18,4Sum,Medium, https://leetcode.com/problems/4sum,amazon; facebook; facebook; samsung; amazon; samsung; amazon; amazon,
19,Remove Nth Node From End of List,Medium, https://leetcode.com/problems/remove-nth-node-from-end-of-list,amazon; facebook; oracle; facebook; goldman-sachs; goldman-sachs; goldman-sachs; facebook; oracle; cisco; goldman-sachs; amazon; facebook; cisco; vmware; amazon; vmware; amazon; oracle,
20,Valid Parentheses,Easy, https://leetcode.com/problems/valid-parentheses,amazon; linkedin; intel; facebook; godaddy; vmware; jpmorgan; visa; oracle; facebook; oracle; godaddy; visa; barclays; intel; citadel; goldman-sachs; twilio; salesforce; salesforce; intel; barclays; godaddy; salesforce; servicenow; paypal; goldman-sachs; goldman-sachs; mathworks; jpmorgan; cisco; facebook; jpmorgan; visa; oracle; citadel; cisco; barclays; mathworks; paypal; cisco; jpmorgan; linkedin; goldman-sachs; samsung; amazon; servicenow; servicenow; vmware; samsung; paypal; facebook; cisco; paypal; mathworks; vmware; amazon; citadel; linkedin; citadel; vmware; servicenow; linkedin; airbnb; twilio; amazon; oracle,
21,Merge Two Sorted Lists,Easy, https://leetcode.com/problems/merge-two-sorted-lists,amazon; linkedin; intel; facebook; vmware; oracle; facebook; oracle; visa; intel; capital-one; intel; facebook; visa; oracle; cisco; capital-one; paypal; cisco; linkedin; samsung; amazon; vmware; samsung; paypal; facebook; cisco; vmware; amazon; airbnb; vmware; linkedin; airbnb; amazon; oracle,
22,Generate Parentheses,Medium, https://leetcode.com/problems/generate-parentheses,amazon; facebook; snapchat; facebook; nutanix; salesforce; salesforce; nutanix; snapchat; cisco; nvidia; facebook; cisco; cisco; samsung; amazon; nvidia; samsung; facebook; cisco; nutanix; amazon; nvidia; amazon,
23,Merge k Sorted Lists,Hard, https://leetcode.com/problems/merge-k-sorted-lists,amazon; linkedin; facebook; vmware; oracle; facebook; oracle; salesforce; salesforce; goldman-sachs; mathworks; nvidia; facebook; oracle; cisco; linkedin; goldman-sachs; nvidia; amazon; nvidia; vmware; facebook; cisco; mathworks; vmware; amazon; nvidia; vmware; linkedin; airbnb; amazon; oracle,
24,Swap Nodes in Pairs,Medium, https://leetcode.com/problems/swap-nodes-in-pairs,facebook; oracle; facebook; facebook; oracle; amazon; facebook; amazon; amazon; oracle,
25,Reverse Nodes in k-Group,Hard, https://leetcode.com/problems/reverse-nodes-in-k-group,amazon; facebook; facebook; mathworks; facebook; cisco; mathworks; paypal; mathworks; cisco; amazon; paypal; facebook; cisco; mathworks; vmware; amazon; vmware; amazon,
26,Remove Duplicates from Sorted Array,Easy, https://leetcode.com/problems/remove-duplicates-from-sorted-array,amazon; facebook; oracle; facebook; oracle; servicenow; facebook; oracle; cisco; amazon; servicenow; servicenow; facebook; cisco; vmware; amazon; vmware; servicenow; amazon; oracle,
27,Remove Element,Easy, https://leetcode.com/problems/remove-element,amazon; amazon,
28,Implement strStr(),Easy, https://leetcode.com/problems/implement-strstr,amazon; facebook; oracle; facebook; oracle; citadel; facebook; oracle; citadel; paypal; amazon; vmware; paypal; facebook; vmware; amazon; citadel; vmware; amazon; oracle,
29,Divide Two Integers,Medium, https://leetcode.com/problems/divide-two-integers,amazon; facebook; facebook; facebook; oracle; amazon; facebook; amazon; amazon; oracle,
30,Substring with Concatenation of All Words,Hard, https://leetcode.com/problems/substring-with-concatenation-of-all-words,facebook; facebook; facebook; amazon; amazon; amazon,
31,Next Permutation,Medium, https://leetcode.com/problems/next-permutation,amazon; facebook; rubrik; jpmorgan; facebook; rubrik; jpmorgan; facebook; jpmorgan; samsung; amazon; samsung; facebook; amazon; amazon,
32,Longest Valid Parentheses,Hard, https://leetcode.com/problems/longest-valid-parentheses,amazon; facebook; oracle; facebook; citadel; facebook; oracle; citadel; samsung; amazon; samsung; facebook; amazon; citadel; amazon; oracle,
33,Search in Rotated Sorted Array,Medium, https://leetcode.com/problems/search-in-rotated-sorted-array,amazon; twitch; linkedin; facebook; snapchat; vmware; oracle; facebook; oracle; visa; nutanix; goldman-sachs; salesforce; salesforce; tripadvisor; nutanix; goldman-sachs; snapchat; goldman-sachs; jpmorgan; nvidia; facebook; jpmorgan; visa; oracle; tripadvisor; paypal; cisco; linkedin; goldman-sachs; samsung; amazon; nvidia; vmware; samsung; paypal; facebook; cisco; nutanix; vmware; amazon; linkedin; nvidia; twitch; vmware; linkedin; amazon; oracle,
34,Find First and Last Position of Element in Sorted Array,Medium, https://leetcode.com/problems/find-first-and-last-position-of-element-in-sorted-array,amazon; netflix; linkedin; facebook; qualtrics; oracle; facebook; oracle; visa; netflix; netflix; facebook; visa; oracle; linkedin; amazon; qualtrics; facebook; amazon; linkedin; netflix; airbnb; linkedin; airbnb; amazon; oracle,
35,Search Insert Position,Easy, https://leetcode.com/problems/search-insert-position,amazon; amazon; amazon; amazon,
36,Valid Sudoku,Medium, https://leetcode.com/problems/valid-sudoku,amazon; facebook; oracle; facebook; salesforce; salesforce; roblox; snapchat; facebook; oracle; roblox; roblox; amazon; vmware; vmware; amazon; roblox; vmware; amazon; oracle,
37,Sudoku Solver,Hard, https://leetcode.com/problems/sudoku-solver,amazon; facebook; oracle; facebook; oracle; roblox; snapchat; facebook; oracle; roblox; roblox; amazon; vmware; amazon; roblox; vmware; amazon; oracle,
38,Count and Say,Easy, https://leetcode.com/problems/count-and-say,amazon; facebook; oracle; facebook; oracle; facebook; oracle; amazon; amazon; amazon; oracle,
39,Combination Sum,Medium, https://leetcode.com/problems/combination-sum,amazon; linkedin; facebook; snapchat; facebook; goldman-sachs; snapchat; jpmorgan; facebook; jpmorgan; linkedin; goldman-sachs; amazon; vmware; airbnb; facebook; vmware; amazon; airbnb; vmware; linkedin; airbnb; amazon,
40,Combination Sum II,Medium, https://leetcode.com/problems/combination-sum-ii,amazon; linkedin; facebook; facebook; nutanix; nutanix; snapchat; facebook; linkedin; amazon; facebook; nutanix; amazon; linkedin; amazon,
41,First Missing Positive,Hard, https://leetcode.com/problems/first-missing-positive,amazon; twitch; facebook; databricks; databricks; oracle; facebook; salesforce; databricks; salesforce; salesforce; facebook; oracle; salesforce; amazon; databricks; vmware; amazon; twitch; vmware; amazon; oracle,
42,Trapping Rain Water,Hard, https://leetcode.com/problems/trapping-rain-water,amazon; facebook; snapchat; databricks; palantir-technologies; qualtrics; dataminr; visa; oracle; facebook; oracle; visa; citadel; goldman-sachs; palantir-technologies; salesforce; databricks; snapchat; palantir-technologies; salesforce; salesforce; servicenow; goldman-sachs; snapchat; goldman-sachs; dataminr; nvidia; facebook; visa; oracle; citadel; goldman-sachs; amazon; nvidia; qualtrics; servicenow; servicenow; airbnb; facebook; databricks; amazon; citadel; qualtrics; visa; citadel; airbnb; servicenow; airbnb; amazon; oracle,
43,Multiply Strings,Medium, https://leetcode.com/problems/multiply-strings,facebook; oracle; facebook; mathworks; facebook; oracle; amazon; facebook; mathworks; amazon; amazon; oracle,
44,Wildcard Matching,Hard, https://leetcode.com/problems/wildcard-matching,amazon; facebook; facebook; goldman-sachs; goldman-sachs; snapchat; facebook; oracle; goldman-sachs; amazon; facebook; amazon; amazon; oracle,
45,Jump Game II,Hard, https://leetcode.com/problems/jump-game-ii,amazon; facebook; nutanix; nutanix; nutanix; facebook; oracle; amazon; nutanix; amazon; amazon; oracle,
46,Permutations,Medium, https://leetcode.com/problems/permutations,amazon; linkedin; facebook; godaddy; oracle; facebook; goldman-sachs; salesforce; salesforce; godaddy; goldman-sachs; facebook; oracle; paypal; cisco; linkedin; goldman-sachs; amazon; paypal; facebook; cisco; vmware; amazon; linkedin; vmware; linkedin; amazon; oracle,
47,Permutations II,Medium, https://leetcode.com/problems/permutations-ii,linkedin; facebook; facebook; linkedin; amazon; vmware; amazon; vmware; linkedin; amazon,
48,Rotate Image,Medium, https://leetcode.com/problems/rotate-image,amazon; facebook; palantir-technologies; facebook; palantir-technologies; salesforce; palantir-technologies; salesforce; salesforce; cisco; nvidia; facebook; cisco; cisco; amazon; nvidia; facebook; cisco; amazon; amazon,
49,Group Anagrams,Medium, https://leetcode.com/problems/group-anagrams,amazon; facebook; snapchat; vmware; qualtrics; oracle; facebook; oracle; visa; nutanix; goldman-sachs; twilio; salesforce; salesforce; servicenow; goldman-sachs; snapchat; goldman-sachs; mathworks; cisco; facebook; visa; oracle; cisco; mathworks; cisco; goldman-sachs; amazon; qualtrics; servicenow; servicenow; vmware; facebook; cisco; nutanix; mathworks; vmware; amazon; vmware; servicenow; twilio; amazon; oracle,
50,Pow(x;n),Medium, https://leetcode.com/problems/powx-n,amazon; linkedin; facebook; oracle; facebook; oracle; goldman-sachs; goldman-sachs; facebook; oracle; linkedin; goldman-sachs; amazon; vmware; facebook; vmware; amazon; linkedin; vmware; linkedin; amazon; oracle,
51,N-Queens,Hard, https://leetcode.com/problems/n-queens,amazon; facebook; rubrik; oracle; facebook; rubrik; facebook; oracle; amazon; amazon; amazon; oracle,
52,N-Queens II,Hard, https://leetcode.com/problems/n-queens-ii,amazon; amazon; amazon,
53,Maximum Subarray,Easy, https://leetcode.com/problems/maximum-subarray,amazon; linkedin; facebook; jpmorgan; oracle; facebook; oracle; visa; intel; citadel; goldman-sachs; palantir-technologies; salesforce; palantir-technologies; salesforce; capital-one; intel; salesforce; paypal; goldman-sachs; goldman-sachs; jpmorgan; cisco; nvidia; facebook; jpmorgan; visa; oracle; citadel; cisco; capital-one; paypal; cisco; linkedin; goldman-sachs; amazon; nvidia; qualcomm; paypal; facebook; cisco; qualcomm; paypal; capital-one; amazon; citadel; linkedin; linkedin; amazon; oracle,
54,Spiral Matrix,Medium, https://leetcode.com/problems/spiral-matrix,amazon; linkedin; facebook; snapchat; visa; oracle; facebook; oracle; visa; goldman-sachs; snapchat; goldman-sachs; snapchat; facebook; visa; oracle; cisco; paypal; cisco; goldman-sachs; amazon; paypal; facebook; cisco; amazon; linkedin; amazon; oracle,
55,Jump Game,Medium, https://leetcode.com/problems/jump-game,amazon; facebook; nutanix; oracle; facebook; nutanix; nutanix; facebook; oracle; amazon; facebook; nutanix; vmware; amazon; vmware; amazon; oracle,
56,Merge Intervals,Medium, https://leetcode.com/problems/merge-intervals,amazon; twitch; netflix; linkedin; facebook; snapchat; godaddy; vmware; palantir-technologies; dataminr; oracle; facebook; oracle; visa; netflix; goldman-sachs; palantir-technologies; salesforce; snapchat; palantir-technologies; salesforce; twitch; netflix; godaddy; salesforce; servicenow; paypal; goldman-sachs; snapchat; goldman-sachs; cisco; dataminr; facebook; visa; oracle; salesforce; cisco; paypal; cisco; linkedin; goldman-sachs; amazon; servicenow; servicenow; vmware; paypal; facebook; cisco; paypal; vmware; amazon; linkedin; netflix; twitch; palantir-technologies; vmware; servicenow; linkedin; amazon; oracle,
57,Insert Interval,Hard, https://leetcode.com/problems/insert-interval,amazon; linkedin; facebook; dataminr; oracle; facebook; dataminr; dataminr; facebook; oracle; linkedin; amazon; facebook; amazon; linkedin; amazon; oracle,
59,Spiral Matrix II,Medium, https://leetcode.com/problems/spiral-matrix-ii,facebook; facebook; oracle; amazon; amazon; amazon; oracle,
60,Permutation Sequence,Hard, https://leetcode.com/problems/permutation-sequence,facebook; facebook; facebook; amazon; amazon; amazon,
61,Rotate List,Medium, https://leetcode.com/problems/rotate-list,amazon; linkedin; facebook; facebook; facebook; linkedin; amazon; amazon; linkedin; amazon,
62,Unique Paths,Medium, https://leetcode.com/problems/unique-paths,amazon; facebook; snapchat; oracle; facebook; oracle; goldman-sachs; goldman-sachs; snapchat; goldman-sachs; mathworks; facebook; oracle; mathworks; goldman-sachs; amazon; facebook; mathworks; vmware; amazon; vmware; amazon; oracle,
63,Unique Paths II,Medium, https://leetcode.com/problems/unique-paths-ii,amazon; facebook; snapchat; godaddy; vmware; facebook; godaddy; goldman-sachs; snapchat; mathworks; facebook; mathworks; goldman-sachs; amazon; vmware; mathworks; vmware; amazon; vmware; amazon,
64,Minimum Path Sum,Medium, https://leetcode.com/problems/minimum-path-sum,amazon; facebook; rubrik; facebook; goldman-sachs; rubrik; goldman-sachs; goldman-sachs; nvidia; facebook; goldman-sachs; amazon; nvidia; facebook; amazon; amazon,
65,Valid Number,Hard, https://leetcode.com/problems/valid-number,amazon; linkedin; facebook; facebook; tripadvisor; facebook; tripadvisor; linkedin; amazon; facebook; amazon; linkedin; amazon,
66,Plus One,Easy, https://leetcode.com/problems/plus-one,amazon; facebook; facebook; capital-one; facebook; capital-one; capital-one; amazon; facebook; capital-one; amazon; amazon,
67,Add Binary,Easy, https://leetcode.com/problems/add-binary,amazon; facebook; facebook; facebook; oracle; amazon; facebook; amazon; amazon; oracle,
68,Text Justification,Hard, https://leetcode.com/problems/text-justification,amazon; linkedin; facebook; snapchat; twilio; snapchat; paypal; snapchat; facebook; paypal; linkedin; amazon; twilio; paypal; airbnb; paypal; amazon; airbnb; twilio; linkedin; airbnb; twilio; amazon,
69,Sqrt(x),Easy, https://leetcode.com/problems/sqrtx,amazon; linkedin; facebook; qualtrics; facebook; linkedin; amazon; qualtrics; amazon; linkedin; amazon,
70,Climbing Stairs,Easy, https://leetcode.com/problems/climbing-stairs,amazon; linkedin; facebook; oracle; facebook; tripadvisor; citadel; tripadvisor; goldman-sachs; nvidia; facebook; oracle; citadel; tripadvisor; linkedin; goldman-sachs; amazon; nvidia; facebook; amazon; citadel; linkedin; amazon; oracle,
71,Simplify Path,Medium, https://leetcode.com/problems/simplify-path,amazon; facebook; oracle; facebook; oracle; salesforce; salesforce; facebook; oracle; amazon; facebook; amazon; amazon; oracle,
72,Edit Distance,Hard, https://leetcode.com/problems/edit-distance,amazon; linkedin; facebook; facebook; goldman-sachs; facebook; paypal; linkedin; goldman-sachs; amazon; qualcomm; paypal; qualcomm; vmware; amazon; vmware; linkedin; amazon,
73,Set Matrix Zeroes,Medium, https://leetcode.com/problems/set-matrix-zeroes,amazon; facebook; oracle; facebook; salesforce; salesforce; tripadvisor; paypal; facebook; oracle; tripadvisor; paypal; amazon; paypal; facebook; paypal; amazon; amazon; oracle,
74,Search a 2D Matrix,Medium, https://leetcode.com/problems/search-a-2d-matrix,amazon; facebook; facebook; facebook; amazon; facebook; amazon; amazon,
75,Sort Colors,Medium, https://leetcode.com/problems/sort-colors,amazon; linkedin; facebook; oracle; facebook; oracle; facebook; oracle; paypal; linkedin; amazon; paypal; facebook; paypal; vmware; amazon; linkedin; vmware; linkedin; amazon; oracle,
76,Minimum Window Substring,Hard, https://leetcode.com/problems/minimum-window-substring,amazon; linkedin; facebook; snapchat; godaddy; visa; oracle; facebook; godaddy; visa; nutanix; goldman-sachs; salesforce; salesforce; godaddy; salesforce; goldman-sachs; snapchat; goldman-sachs; facebook; visa; oracle; linkedin; goldman-sachs; amazon; facebook; nutanix; vmware; amazon; airbnb; vmware; linkedin; airbnb; amazon; oracle,
77,Combinations,Medium, https://leetcode.com/problems/combinations,amazon; facebook; facebook; facebook; amazon; amazon; amazon,
78,Subsets,Medium, https://leetcode.com/problems/subsets,amazon; facebook; facebook; goldman-sachs; goldman-sachs; facebook; goldman-sachs; amazon; facebook; amazon; amazon,
79,Word Search,Medium, https://leetcode.com/problems/word-search,amazon; linkedin; facebook; snapchat; oracle; facebook; snapchat; snapchat; jpmorgan; facebook; jpmorgan; oracle; amazon; facebook; vmware; amazon; vmware; linkedin; amazon; oracle,
80,Remove Duplicates from Sorted Array II,Medium, https://leetcode.com/problems/remove-duplicates-from-sorted-array-ii,facebook; vmware; amazon; vmware; vmware; amazon; vmware,
81,Search in Rotated Sorted Array II,Medium, https://leetcode.com/problems/search-in-rotated-sorted-array-ii,amazon; facebook; facebook; facebook; amazon; facebook; amazon; amazon,
82,Remove Duplicates from Sorted List II,Medium, https://leetcode.com/problems/remove-duplicates-from-sorted-list-ii,amazon; salesforce; salesforce; paypal; amazon; paypal; amazon; amazon,
83,Remove Duplicates from Sorted List,Easy, https://leetcode.com/problems/remove-duplicates-from-sorted-list,facebook; facebook; salesforce; salesforce; facebook; amazon; amazon; amazon,
84,Largest Rectangle in Histogram,Hard, https://leetcode.com/problems/largest-rectangle-in-histogram,amazon; facebook; facebook; facebook; amazon; amazon; amazon,
85,Maximal Rectangle,Hard, https://leetcode.com/problems/maximal-rectangle,amazon; facebook; citadel; facebook; citadel; samsung; amazon; samsung; vmware; amazon; citadel; citadel; samsung; vmware; amazon,
86,Partition List,Medium, https://leetcode.com/problems/partition-list,amazon; amazon; amazon; amazon,
88,Merge Sorted Array,Easy, https://leetcode.com/problems/merge-sorted-array,amazon; linkedin; facebook; oracle; facebook; oracle; netflix; netflix; goldman-sachs; facebook; oracle; cisco; cisco; linkedin; goldman-sachs; amazon; vmware; facebook; cisco; vmware; amazon; vmware; linkedin; amazon; oracle,
89,Gray Code,Medium, https://leetcode.com/problems/gray-code,amazon,
90,Subsets II,Medium, https://leetcode.com/problems/subsets-ii,amazon; facebook; facebook; facebook; amazon; facebook; amazon; amazon,
91,Decode Ways,Medium, https://leetcode.com/problems/decode-ways,amazon; facebook; snapchat; databricks; oracle; facebook; goldman-sachs; databricks; snapchat; barclays; goldman-sachs; snapchat; cisco; facebook; oracle; cisco; barclays; cisco; goldman-sachs; amazon; facebook; cisco; databricks; amazon; amazon; oracle,
92,Reverse Linked List II,Medium, https://leetcode.com/problems/reverse-linked-list-ii,amazon; facebook; oracle; facebook; oracle; facebook; oracle; amazon; facebook; amazon; amazon; oracle,
93,Restore IP Addresses,Medium, https://leetcode.com/problems/restore-ip-addresses,amazon; facebook; facebook; facebook; amazon; vmware; facebook; vmware; amazon; vmware; amazon,
94,Binary Tree Inorder Traversal,Medium, https://leetcode.com/problems/binary-tree-inorder-traversal,amazon; facebook; oracle; facebook; oracle; facebook; oracle; amazon; facebook; amazon; amazon; oracle,
95,Unique Binary Search Trees II,Medium, https://leetcode.com/problems/unique-binary-search-trees-ii,facebook; facebook; facebook; amazon; facebook; amazon,
96,Unique Binary Search Trees,Medium, https://leetcode.com/problems/unique-binary-search-trees,amazon; facebook; facebook; snapchat; facebook; amazon; amazon; amazon,
97,Interleaving String,Hard, https://leetcode.com/problems/interleaving-string,amazon; vmware; nvidia; amazon; nvidia; vmware; vmware; amazon; vmware; amazon,
98,Validate Binary Search Tree,Medium, https://leetcode.com/problems/validate-binary-search-tree,amazon; linkedin; facebook; vmware; visa; oracle; facebook; visa; goldman-sachs; salesforce; salesforce; capital-one; tripadvisor; salesforce; goldman-sachs; mathworks; facebook; visa; oracle; tripadvisor; capital-one; goldman-sachs; amazon; vmware; facebook; mathworks; vmware; amazon; visa; vmware; linkedin; amazon; oracle,
99,Recover Binary Search Tree,Hard, https://leetcode.com/problems/recover-binary-search-tree,amazon; facebook; goldman-sachs; goldman-sachs; goldman-sachs; facebook; goldman-sachs; amazon; amazon; amazon,
