230,Kth Smallest Element in a BST,Medium, https://leetcode.com/problems/kth-smallest-element-in-a-bst,amazon; facebook; oracle; facebook; oracle; facebook; oracle; amazon; vmware; facebook; vmware; amazon; vmware; amazon; oracle,
231,Power of Two,Easy, https://leetcode.com/problems/power-of-two,nvidia; nvidia; amazon; nvidia; amazon; nvidia,
232,Implement Queue using Stacks,Easy, https://leetcode.com/problems/implement-queue-using-stacks,amazon; oracle; citadel; salesforce; salesforce; mathworks; oracle; citadel; mathworks; amazon; mathworks; amazon; citadel; citadel; amazon; oracle,
233,Number of Digit One,Hard, https://leetcode.com/problems/number-of-digit-one,amazon; amazon; amazon,
234,Palindrome Linked List,Easy, https://leetcode.com/problems/palindrome-linked-list,amazon; facebook; snapchat; facebook; nutanix; intel; snapchat; intel; nutanix; snapchat; cisco; facebook; cisco; cisco; amazon; snapchat; facebook; cisco; nutanix; vmware; amazon; vmware; amazon,
235,Lowest Common Ancestor of a Binary Search Tree,Easy, https://leetcode.com/problems/lowest-common-ancestor-of-a-binary-search-tree,amazon; linkedin; facebook; oracle; facebook; facebook; oracle; cisco; linkedin; amazon; facebook; cisco; amazon; linkedin; amazon; oracle,
236,Lowest Common Ancestor of a Binary Tree,Medium, https://leetcode.com/problems/lowest-common-ancestor-of-a-binary-tree,amazon; linkedin; facebook; oracle; facebook; visa; salesforce; salesforce; facebook; visa; oracle; paypal; linkedin; amazon; paypal; airbnb; facebook; amazon; airbnb; linkedin; airbnb; amazon; oracle,
237,Delete Node in a Linked List,Easy, https://leetcode.com/problems/delete-node-in-a-linked-list,facebook; facebook; goldman-sachs; goldman-sachs; goldman-sachs; facebook; cisco; goldman-sachs; amazon; qualcomm; cisco; qualcomm; amazon; qualcomm; amazon,
238,Product of Array Except Self,Medium, https://leetcode.com/problems/product-of-array-except-self,amazon; linkedin; facebook; snapchat; qualtrics; oracle; facebook; visa; nutanix; intel; goldman-sachs; salesforce; salesforce; intel; nutanix; servicenow; goldman-sachs; snapchat; goldman-sachs; facebook; visa; oracle; paypal; goldman-sachs; amazon; qualtrics; servicenow; servicenow; paypal; facebook; nutanix; vmware; amazon; qualtrics; vmware; servicenow; amazon; oracle,
239,Sliding Window Maximum,Hard, https://leetcode.com/problems/sliding-window-maximum,amazon; facebook; databricks; databricks; oracle; facebook; oracle; nutanix; citadel; databricks; roblox; facebook; oracle; roblox; roblox; citadel; amazon; databricks; nutanix; vmware; amazon; roblox; citadel; citadel; vmware; amazon; oracle,
240,Search a 2D Matrix II,Medium, https://leetcode.com/problems/search-a-2d-matrix-ii,amazon; linkedin; facebook; oracle; facebook; oracle; citadel; salesforce; salesforce; goldman-sachs; facebook; oracle; citadel; paypal; goldman-sachs; amazon; paypal; facebook; amazon; citadel; linkedin; amazon; oracle,
241,Different Ways to Add Parentheses,Medium, https://leetcode.com/problems/different-ways-to-add-parentheses,facebook; citadel; facebook; citadel; cisco; cisco; amazon; cisco; amazon; citadel; citadel; amazon,
242,Valid Anagram,Easy, https://leetcode.com/problems/valid-anagram,amazon; facebook; snapchat; oracle; facebook; oracle; goldman-sachs; servicenow; goldman-sachs; snapchat; goldman-sachs; facebook; oracle; paypal; cisco; goldman-sachs; amazon; paypal; facebook; cisco; paypal; amazon; servicenow; amazon; oracle,
243,Shortest Word Distance,Easy, https://leetcode.com/problems/shortest-word-distance,amazon; linkedin; oracle; oracle; paypal; linkedin; amazon; paypal; paypal; vmware; amazon; linkedin; vmware; linkedin; amazon; oracle,
244,Shortest Word Distance II,Medium, https://leetcode.com/problems/shortest-word-distance-ii,linkedin; linkedin; amazon; amazon; linkedin; linkedin,
245,Shortest Word Distance III,Medium, https://leetcode.com/problems/shortest-word-distance-iii,linkedin,
246,Strobogrammatic Number,Easy, https://leetcode.com/problems/strobogrammatic-number,facebook; facebook; cisco; facebook; cisco; cisco; facebook; cisco,
247,Strobogrammatic Number II,Medium, https://leetcode.com/problems/strobogrammatic-number-ii,facebook; facebook; facebook; cisco; facebook; cisco,
248,Strobogrammatic Number III,Hard, https://leetcode.com/problems/strobogrammatic-number-iii,facebook; facebook,
249,Group Shifted Strings,Medium, https://leetcode.com/problems/group-shifted-strings,amazon; facebook; facebook; facebook; amazon; facebook; amazon; amazon,
250,Count Univalue Subtrees,Medium, https://leetcode.com/problems/count-univalue-subtrees,facebook; facebook; amazon; amazon; amazon,
251,Flatten 2D Vector,Medium, https://leetcode.com/problems/flatten-2d-vector,facebook; airbnb; salesforce; salesforce; facebook; airbnb; airbnb; airbnb,
252,Meeting Rooms,Easy, https://leetcode.com/problems/meeting-rooms,facebook; facebook; amazon; amazon; amazon,
253,Meeting Rooms II,Medium, https://leetcode.com/problems/meeting-rooms-ii,amazon; citrix; facebook; snapchat; godaddy; visa; oracle; facebook; oracle; godaddy; visa; nutanix; citadel; goldman-sachs; snapchat; citrix; nutanix; godaddy; goldman-sachs; snapchat; facebook; visa; oracle; citrix; citadel; paypal; cisco; goldman-sachs; amazon; paypal; facebook; cisco; nutanix; amazon; citadel; citadel; amazon; oracle,
254,Factor Combinations,Medium, https://leetcode.com/problems/factor-combinations,linkedin; linkedin; linkedin; linkedin,
255,Verify Preorder Sequence in Binary Search Tree,Medium, https://leetcode.com/problems/verify-preorder-sequence-in-binary-search-tree,mathworks; mathworks; mathworks,
256,Paint House,Easy, https://leetcode.com/problems/paint-house,linkedin; linkedin; linkedin; linkedin,
257,Binary Tree Paths,Easy, https://leetcode.com/problems/binary-tree-paths,facebook; facebook; facebook; amazon; facebook; amazon; amazon,
259,3Sum Smaller,Medium, https://leetcode.com/problems/3sum-smaller,mathworks; mathworks; mathworks; mathworks,
260,Single Number III,Medium, https://leetcode.com/problems/single-number-iii,amazon; facebook; facebook; facebook; amazon; facebook; amazon; amazon,
261,Graph Valid Tree,Medium, https://leetcode.com/problems/graph-valid-tree,amazon; linkedin; facebook; linkedin; amazon; amazon; linkedin; linkedin; amazon,
262,Trips and Users,Hard, https://leetcode.com/problems/trips-and-users,amazon; amazon; amazon; amazon,
264,Ugly Number II,Medium, https://leetcode.com/problems/ugly-number-ii,amazon; oracle; oracle; amazon; amazon; amazon; oracle,
265,Paint House II,Hard, https://leetcode.com/problems/paint-house-ii,linkedin; facebook; linkedin; linkedin,
266,Palindrome Permutation,Easy, https://leetcode.com/problems/palindrome-permutation,facebook; facebook; facebook; amazon; facebook; amazon; amazon,
267,Palindrome Permutation II,Medium, https://leetcode.com/problems/palindrome-permutation-ii,amazon; amazon,
268,Missing Number,Easy, https://leetcode.com/problems/missing-number,amazon; facebook; facebook; servicenow; facebook; oracle; amazon; facebook; vmware; amazon; vmware; servicenow; amazon; oracle,
269,Alien Dictionary,Hard, https://leetcode.com/problems/alien-dictionary,amazon; facebook; facebook; snapchat; facebook; amazon; vmware; airbnb; facebook; vmware; amazon; airbnb; vmware; airbnb; amazon,
270,Closest Binary Search Tree Value,Easy, https://leetcode.com/problems/closest-binary-search-tree-value,linkedin; facebook; facebook; snapchat; facebook; amazon; facebook; amazon; linkedin; amazon,
272,Closest Binary Search Tree Value II,Hard, https://leetcode.com/problems/closest-binary-search-tree-value-ii,linkedin; facebook; facebook; facebook; linkedin; amazon; facebook; amazon; linkedin; linkedin; amazon,
273,Integer to English Words,Hard, https://leetcode.com/problems/integer-to-english-words,amazon; citrix; linkedin; facebook; oracle; facebook; visa; nutanix; palantir-technologies; palantir-technologies; capital-one; barclays; nutanix; jpmorgan; facebook; jpmorgan; visa; oracle; citrix; barclays; capital-one; paypal; linkedin; amazon; paypal; facebook; nutanix; amazon; linkedin; amazon; oracle,
274,H-Index,Medium, https://leetcode.com/problems/h-index,facebook; tripadvisor; tripadvisor,
275,H-Index II,Medium, https://leetcode.com/problems/h-index-ii,facebook,
277,Find the Celebrity,Medium, https://leetcode.com/problems/find-the-celebrity,amazon; linkedin; facebook; palantir-technologies; facebook; palantir-technologies; palantir-technologies; facebook; linkedin; amazon; facebook; vmware; amazon; vmware; linkedin; amazon,
278,First Bad Version,Easy, https://leetcode.com/problems/first-bad-version,facebook; facebook; facebook; amazon; facebook; amazon,
279,Perfect Squares,Medium, https://leetcode.com/problems/perfect-squares,amazon; linkedin; facebook; godaddy; godaddy; facebook; cisco; cisco; amazon; cisco; amazon; linkedin; amazon,
280,Wiggle Sort,Medium, https://leetcode.com/problems/wiggle-sort,facebook; facebook; facebook; amazon; airbnb; facebook; amazon; airbnb; airbnb,
281,Zigzag Iterator,Medium, https://leetcode.com/problems/zigzag-iterator,amazon; amazon,
282,Expression Add Operators,Hard, https://leetcode.com/problems/expression-add-operators,facebook; snapchat; facebook; snapchat; facebook; facebook,
283,Move Zeroes,Easy, https://leetcode.com/problems/move-zeroes,amazon; facebook; oracle; facebook; oracle; nutanix; goldman-sachs; nutanix; goldman-sachs; facebook; oracle; paypal; goldman-sachs; amazon; qualcomm; paypal; facebook; qualcomm; nutanix; amazon; amazon; oracle,
284,Peeking Iterator,Medium, https://leetcode.com/problems/peeking-iterator,facebook; facebook; facebook; oracle; amazon; facebook; amazon; amazon; oracle,
285,Inorder Successor in BST,Medium, https://leetcode.com/problems/inorder-successor-in-bst,amazon; facebook; facebook; citadel; palantir-technologies; palantir-technologies; facebook; citadel; amazon; facebook; amazon; citadel; citadel; amazon,
286,Walls and Gates,Medium, https://leetcode.com/problems/walls-and-gates,amazon; facebook; facebook; facebook; amazon; facebook; amazon; amazon,
287,Find the Duplicate Number,Medium, https://leetcode.com/problems/find-the-duplicate-number,amazon; facebook; facebook; salesforce; salesforce; facebook; oracle; amazon; facebook; vmware; amazon; vmware; amazon; oracle,
289,Game of Life,Medium, https://leetcode.com/problems/game-of-life,amazon; facebook; oracle; facebook; goldman-sachs; goldman-sachs; snapchat; goldman-sachs; opendoor; facebook; oracle; opendoor; goldman-sachs; amazon; amazon; amazon; oracle,
290,Word Pattern,Easy, https://leetcode.com/problems/word-pattern,amazon; facebook; capital-one; facebook; capital-one; capital-one; amazon; capital-one; amazon; amazon,
291,Word Pattern II,Hard, https://leetcode.com/problems/word-pattern-ii,facebook; facebook,
295,Find Median from Data Stream,Hard, https://leetcode.com/problems/find-median-from-data-stream,amazon; netflix; facebook; snapchat; qualtrics; facebook; citadel; netflix; salesforce; salesforce; netflix; salesforce; goldman-sachs; snapchat; facebook; oracle; salesforce; citadel; goldman-sachs; amazon; qualtrics; facebook; vmware; amazon; citadel; netflix; vmware; amazon; oracle,
296,Best Meeting Point,Hard, https://leetcode.com/problems/best-meeting-point,amazon; linkedin; facebook; snapchat; snapchat; facebook; amazon; amazon; linkedin; amazon,
297,Serialize and Deserialize Binary Tree,Hard, https://leetcode.com/problems/serialize-and-deserialize-binary-tree,amazon; linkedin; facebook; snapchat; qualtrics; oracle; facebook; citadel; salesforce; snapchat; salesforce; snapchat; facebook; oracle; citadel; linkedin; amazon; qualtrics; vmware; snapchat; facebook; vmware; amazon; citadel; linkedin; vmware; linkedin; amazon; oracle,
298,Binary Tree Longest Consecutive Sequence,Medium, https://leetcode.com/problems/binary-tree-longest-consecutive-sequence,facebook; facebook; facebook; amazon; amazon; amazon,
299,Bulls and Cows,Easy, https://leetcode.com/problems/bulls-and-cows,amazon; amazon; amazon; airbnb; airbnb; amazon,
300,Longest Increasing Subsequence,Medium, https://leetcode.com/problems/longest-increasing-subsequence,amazon; facebook; oracle; facebook; salesforce; salesforce; facebook; oracle; amazon; facebook; vmware; amazon; vmware; amazon; oracle,
301,Remove Invalid Parentheses,Hard, https://leetcode.com/problems/remove-invalid-parentheses,amazon; facebook; facebook; facebook; amazon; facebook; amazon; amazon,
303,Range Sum Query - Immutable,Easy, https://leetcode.com/problems/range-sum-query-immutable,facebook; facebook; palantir-technologies; facebook; amazon; amazon; amazon,
304,Range Sum Query 2D - Immutable,Medium, https://leetcode.com/problems/range-sum-query-2d-immutable,amazon; facebook; facebook; facebook; amazon; facebook; vmware; amazon; vmware; amazon,
305,Number of Islands II,Hard, https://leetcode.com/problems/number-of-islands-ii,facebook; snapchat; oracle; facebook; snapchat; facebook; oracle; amazon; amazon; oracle,
307,Range Sum Query - Mutable,Medium, https://leetcode.com/problems/range-sum-query-mutable,facebook; facebook; facebook; amazon; amazon; amazon,
308,Range Sum Query 2D - Mutable,Hard, https://leetcode.com/problems/range-sum-query-2d-mutable,facebook; facebook,
309,Best Time to Buy and Sell Stock with Cooldown,Medium, https://leetcode.com/problems/best-time-to-buy-and-sell-stock-with-cooldown,amazon; facebook; facebook; facebook; amazon; amazon; amazon,
310,Minimum Height Trees,Medium, https://leetcode.com/problems/minimum-height-trees,amazon; facebook; snapchat; snapchat; snapchat; facebook; amazon; amazon; amazon,
311,Sparse Matrix Multiplication,Medium, https://leetcode.com/problems/sparse-matrix-multiplication,linkedin; facebook; snapchat; facebook; snapchat; facebook; amazon; facebook; amazon,
312,Burst Balloons,Hard, https://leetcode.com/problems/burst-balloons,amazon; facebook; facebook; snapchat; facebook; samsung; amazon; samsung; amazon; samsung; amazon,
314,Binary Tree Vertical Order Traversal,Medium, https://leetcode.com/problems/binary-tree-vertical-order-traversal,amazon; facebook; databricks; databricks; oracle; facebook; salesforce; databricks; salesforce; snapchat; mathworks; facebook; oracle; amazon; facebook; databricks; mathworks; amazon; amazon; oracle,
315,Count of Smaller Numbers After Self,Hard, https://leetcode.com/problems/count-of-smaller-numbers-after-self,amazon; facebook; facebook; oracle; amazon; amazon; amazon; oracle,
316,Remove Duplicate Letters,Hard, https://leetcode.com/problems/remove-duplicate-letters,amazon; facebook; nutanix; facebook; amazon; nutanix; amazon; amazon,
317,Shortest Distance from All Buildings,Hard, https://leetcode.com/problems/shortest-distance-from-all-buildings,amazon; facebook; snapchat; facebook; snapchat; goldman-sachs; snapchat; mathworks; facebook; mathworks; goldman-sachs; amazon; snapchat; facebook; mathworks; amazon; amazon,
319,Bulb Switcher,Medium, https://leetcode.com/problems/bulb-switcher,facebook; facebook; mathworks; facebook; amazon; mathworks; amazon,
321,Create Maximum Number,Hard, https://leetcode.com/problems/create-maximum-number,amazon; amazon; amazon,
322,Coin Change,Medium, https://leetcode.com/problems/coin-change,amazon; linkedin; facebook; oracle; visa; goldman-sachs; capital-one; goldman-sachs; goldman-sachs; jpmorgan; facebook; jpmorgan; visa; oracle; capital-one; paypal; goldman-sachs; amazon; vmware; paypal; airbnb; capital-one; vmware; amazon; airbnb; vmware; linkedin; airbnb; amazon; oracle,
323,Number of Connected Components in an Undirected Graph,Medium, https://leetcode.com/problems/number-of-connected-components-in-an-undirected-graph,amazon; linkedin; facebook; facebook; facebook; amazon; facebook; amazon; linkedin; amazon,
324,Wiggle Sort II,Medium, https://leetcode.com/problems/wiggle-sort-ii,facebook; facebook; paypal; facebook; paypal; paypal; airbnb; paypal; airbnb; airbnb,
325,Maximum Size Subarray Sum Equals k,Medium, https://leetcode.com/problems/maximum-size-subarray-sum-equals-k,facebook; facebook; palantir-technologies; facebook; amazon; amazon; amazon,
326,Power of Three,Easy, https://leetcode.com/problems/power-of-three,goldman-sachs; goldman-sachs; goldman-sachs; goldman-sachs,
328,Odd Even Linked List,Medium, https://leetcode.com/problems/odd-even-linked-list,facebook; facebook; capital-one; facebook; capital-one; capital-one; amazon; facebook; capital-one; amazon; amazon,
329,Longest Increasing Path in a Matrix,Hard, https://leetcode.com/problems/longest-increasing-path-in-a-matrix,amazon; facebook; snapchat; facebook; snapchat; snapchat; facebook; amazon; facebook; amazon; amazon,
332,Reconstruct Itinerary,Medium, https://leetcode.com/problems/reconstruct-itinerary,amazon; facebook; snapchat; qualtrics; facebook; citadel; goldman-sachs; twilio; goldman-sachs; snapchat; facebook; citadel; goldman-sachs; amazon; twilio; qualtrics; facebook; amazon; citadel; qualtrics; twilio; amazon,
333,Largest BST Subtree,Medium, https://leetcode.com/problems/largest-bst-subtree,amazon; facebook; facebook; facebook; amazon; facebook; amazon; amazon,
334,Increasing Triplet Subsequence,Medium, https://leetcode.com/problems/increasing-triplet-subsequence,facebook; facebook; facebook; amazon; facebook; amazon; amazon,
335,Self Crossing,Hard, https://leetcode.com/problems/self-crossing,amazon; amazon; amazon; amazon,
336,Palindrome Pairs,Hard, https://leetcode.com/problems/palindrome-pairs,amazon; facebook; facebook; facebook; amazon; airbnb; amazon; airbnb; airbnb; amazon,
337,House Robber III,Medium, https://leetcode.com/problems/house-robber-iii,amazon; facebook; facebook; amazon; amazon; amazon,
338,Counting Bits,Medium, https://leetcode.com/problems/counting-bits,facebook; facebook; mathworks; facebook; mathworks; mathworks; amazon; facebook; mathworks; amazon; amazon,
339,Nested List Weight Sum,Easy, https://leetcode.com/problems/nested-list-weight-sum,linkedin; facebook; facebook; facebook; linkedin; amazon; facebook; amazon; linkedin; linkedin; amazon,
340,Longest Substring with At Most K Distinct Characters,Hard, https://leetcode.com/problems/longest-substring-with-at-most-k-distinct-characters,amazon; facebook; snapchat; facebook; citadel; snapchat; snapchat; facebook; oracle; citadel; amazon; snapchat; facebook; amazon; citadel; amazon; oracle,
341,Flatten Nested List Iterator,Medium, https://leetcode.com/problems/flatten-nested-list-iterator,amazon; linkedin; facebook; snapchat; oracle; facebook; oracle; snapchat; facebook; oracle; linkedin; amazon; airbnb; facebook; vmware; amazon; airbnb; vmware; linkedin; airbnb; amazon; oracle,
344,Reverse String,Easy, https://leetcode.com/problems/reverse-string,amazon; facebook; snapchat; godaddy; oracle; facebook; godaddy; servicenow; goldman-sachs; snapchat; facebook; oracle; cisco; paypal; cisco; goldman-sachs; amazon; servicenow; servicenow; paypal; cisco; amazon; servicenow; amazon; oracle,
345,Reverse Vowels of a String,Easy, https://leetcode.com/problems/reverse-vowels-of-a-string,facebook; facebook; facebook; amazon; facebook; amazon; amazon,
346,Moving Average from Data Stream,Easy, https://leetcode.com/problems/moving-average-from-data-stream,facebook; facebook; facebook; amazon; facebook; amazon; amazon,
347,Top K Frequent Elements,Medium, https://leetcode.com/problems/top-k-frequent-elements,amazon; linkedin; facebook; snapchat; oracle; facebook; oracle; goldman-sachs; snapchat; goldman-sachs; snapchat; facebook; oracle; goldman-sachs; amazon; vmware; facebook; vmware; amazon; vmware; linkedin; amazon; oracle,
348,Design Tic-Tac-Toe,Medium, https://leetcode.com/problems/design-tic-tac-toe,amazon; facebook; facebook; salesforce; salesforce; salesforce; facebook; salesforce; amazon; facebook; amazon; amazon,
349,Intersection of Two Arrays,Easy, https://leetcode.com/problems/intersection-of-two-arrays,amazon; linkedin; facebook; oracle; facebook; jpmorgan; facebook; jpmorgan; oracle; linkedin; amazon; facebook; amazon; linkedin; linkedin; amazon; oracle,
350,Intersection of Two Arrays II,Easy, https://leetcode.com/problems/intersection-of-two-arrays-ii,amazon; linkedin; facebook; databricks; facebook; salesforce; salesforce; facebook; oracle; linkedin; amazon; facebook; databricks; amazon; linkedin; amazon; oracle,
351,Android Unlock Patterns,Medium, https://leetcode.com/problems/android-unlock-patterns,amazon; amazon; amazon,
352,Data Stream as Disjoint Intervals,Hard, https://leetcode.com/problems/data-stream-as-disjoint-intervals,amazon; facebook; oracle; facebook; oracle; facebook; oracle; amazon; amazon; amazon; oracle,
353,Design Snake Game,Medium, https://leetcode.com/problems/design-snake-game,amazon; facebook; salesforce; salesforce; facebook; amazon; amazon; amazon,
354,Russian Doll Envelopes,Hard, https://leetcode.com/problems/russian-doll-envelopes,amazon; amazon; amazon; amazon,
355,Design Twitter,Medium, https://leetcode.com/problems/design-twitter,oracle; oracle; oracle; amazon; oracle,
356,Line Reflection,Medium, https://leetcode.com/problems/line-reflection,amazon; amazon; amazon; amazon,
358,Rearrange String k Distance Apart,Hard, https://leetcode.com/problems/rearrange-string-k-distance-apart,facebook; facebook; facebook; amazon; facebook; amazon,
359,Logger Rate Limiter,Easy, https://leetcode.com/problems/logger-rate-limiter,amazon; linkedin; amazon; amazon; linkedin; amazon,
360,Sort Transformed Array,Medium, https://leetcode.com/problems/sort-transformed-array,facebook; facebook,
361,Bomb Enemy,Medium, https://leetcode.com/problems/bomb-enemy,amazon; amazon,
362,Design Hit Counter,Medium, https://leetcode.com/problems/design-hit-counter,amazon; netflix; linkedin; snapchat; visa; oracle; oracle; visa; netflix; netflix; snapchat; visa; oracle; amazon; amazon; netflix; linkedin; amazon; oracle,
363,Max Sum of Rectangle No Larger Than K,Hard, https://leetcode.com/problems/max-sum-of-rectangle-no-larger-than-k,facebook; facebook,
364,Nested List Weight Sum II,Medium, https://leetcode.com/problems/nested-list-weight-sum-ii,linkedin; facebook; facebook; facebook; linkedin; facebook; linkedin; linkedin,
365,Water and Jug Problem,Medium, https://leetcode.com/problems/water-and-jug-problem,amazon; amazon,
366,Find Leaves of Binary Tree,Medium, https://leetcode.com/problems/find-leaves-of-binary-tree,amazon; linkedin; linkedin; amazon; amazon; linkedin; linkedin; amazon,
367,Valid Perfect Square,Easy, https://leetcode.com/problems/valid-perfect-square,linkedin; linkedin; amazon; amazon; linkedin,
368,Largest Divisible Subset,Medium, https://leetcode.com/problems/largest-divisible-subset,amazon; amazon; amazon; amazon,
369,Plus One Linked List,Medium, https://leetcode.com/problems/plus-one-linked-list,amazon; amazon,
371,Sum of Two Integers,Medium, https://leetcode.com/problems/sum-of-two-integers,facebook; facebook; amazon; amazon,
373,Find K Pairs with Smallest Sums,Medium, https://leetcode.com/problems/find-k-pairs-with-smallest-sums,amazon; linkedin; facebook; facebook; facebook; linkedin; amazon; facebook; amazon; linkedin; linkedin; amazon,
376,Wiggle Subsequence,Medium, https://leetcode.com/problems/wiggle-subsequence,facebook; facebook; amazon; amazon,
377,Combination Sum IV,Medium, https://leetcode.com/problems/combination-sum-iv,facebook; visa; snapchat; visa; amazon; amazon,
378,Kth Smallest Element in a Sorted Matrix,Medium, https://leetcode.com/problems/kth-smallest-element-in-a-sorted-matrix,amazon; facebook; facebook; facebook; amazon; facebook; amazon; amazon,
380,Insert Delete GetRandom O(1),Medium, https://leetcode.com/problems/insert-delete-getrandom-o1,amazon; linkedin; facebook; databricks; databricks; visa; oracle; facebook; oracle; visa; goldman-sachs; twilio; salesforce; databricks; salesforce; goldman-sachs; facebook; visa; oracle; linkedin; goldman-sachs; amazon; vmware; facebook; databricks; vmware; amazon; linkedin; vmware; linkedin; twilio; amazon; oracle,
381,Insert Delete GetRandom O(1) - Duplicates allowed,Hard, https://leetcode.com/problems/insert-delete-getrandom-o1-duplicates-allowed,linkedin; facebook; databricks; facebook; databricks; facebook; linkedin; amazon; facebook; databricks; amazon; linkedin; linkedin,
382,Linked List Random Node,Medium, https://leetcode.com/problems/linked-list-random-node,amazon; facebook; facebook; amazon; amazon; amazon,
383,Ransom Note,Easy, https://leetcode.com/problems/ransom-note,amazon; amazon; amazon; amazon,
384,Shuffle an Array,Medium, https://leetcode.com/problems/shuffle-an-array,amazon; linkedin; facebook; facebook; salesforce; salesforce; tripadvisor; facebook; tripadvisor; cisco; amazon; facebook; cisco; amazon; linkedin; amazon,
385,Mini Parser,Medium, https://leetcode.com/problems/mini-parser,airbnb,
387,First Unique Character in a String,Easy, https://leetcode.com/problems/first-unique-character-in-a-string,amazon; linkedin; facebook; facebook; goldman-sachs; servicenow; goldman-sachs; goldman-sachs; jpmorgan; facebook; jpmorgan; linkedin; goldman-sachs; amazon; servicenow; servicenow; facebook; amazon; servicenow; linkedin; amazon,
388,Longest Absolute File Path,Medium, https://leetcode.com/problems/longest-absolute-file-path,facebook; facebook; facebook; amazon; facebook; amazon; amazon,
389,Find the Difference,Easy, https://leetcode.com/problems/find-the-difference,amazon; amazon; amazon; amazon,
390,Elimination Game,Medium, https://leetcode.com/problems/elimination-game,amazon; amazon; amazon,
392,Is Subsequence,Easy, https://leetcode.com/problems/is-subsequence,facebook; facebook; facebook; amazon; facebook; amazon; amazon,
393,UTF-8 Validation,Medium, https://leetcode.com/problems/utf-8-validation,facebook; palantir-technologies; palantir-technologies; palantir-technologies; facebook; amazon; amazon; palantir-technologies,
